#,vivalarevolution,Viva La Revolution,"축하드려요 지도자 동지! 혁명은 성공했고 우리는 진정으로 모든 남녀가 평등한 사회에서 살고 있어요. 저들은 우리가 사회주의 천국을 건설할 수 없다고 말했지만, 우리는 이뤄냈어요. 만국의 노동자들이여, 단결하자!!"
#,cultofpersonality,Cult Of Personality,"잠시 시간을 내어 '인성'의 정의를 검색해보면, 지도자님의 사진을 발견할 수 있을 거예요! 지도자로서 강하고, 인정 많고, 신뢰할 수 있는... 지도자님을 향한 국민들의 찬사가 끝없이 이어지고 있어요."
#,coalitionkid,Coalition Kid,절대권력은 부패하기 마련이지만 연립정부를 이끄는 것보단 훨씬 더 쉬워요. 하지만 지도자님께서는 두 연합체를 하나로 모았지요. 모든 사람들이 지도자님으로부터 팀워크를 포함한 더욱 많은 것을 배울 거예요!
#,livinginthefuture,Living In The Future,"고속 인터넷, 고속 기술, 꽤 괜찮은 우주 프로그램(계획된 화성 임무 포함) 그리고 무인 자동차. 공상과학 소설에나 나오는 얘기가 아니에요. 바로 지도자님의 업적이에요. 크으-! 주모, 셔터내려!"
#,taxahontas,Taxahontas,"""움직이면, 과세하라!"" 그것이 지도자님의 최근 신조였어요. 세법을 복잡하게 만드는 대회에라도 출전하고 싶으신 건가요? 그렇다면, 특별상은 따놓은 당상이네요."
#,everybodyout,Everybody Out!,"이 나라에서 실제로 어떤 일을 하고 있는 사람이 있나요? 요즘 거리 구석구석마다 파업자들이 플래카드를 들고 있는 것 같던데, 역설적이지만 아마 플래카드 공장 직원들은 야근을 하고 있겠군요."
#,dangerousstreets,Dangerous Streets,"외출하시게요? 그렇다면 무장한 경호원과 장갑차를 타고 여행하는 것을 잊지 마세요. 왜냐하면... 오, 이런! 밖이 험하군요. 거리가 피로 흘러넘칠 정도는 아니지만, 확실히 약간은 흐르고 있거든요."
#,heirtoaynrand,Heir to Ayn Rand,"자본주의는 진실이고, 자유고, 사랑이에요! 아..아마도? 한 가지 확실한 건, 지도자님께서는 시장의 '보이지 않는 손'을 회사에 주셨다는 거에요. 그리고 친근하게 악수해주셨죠. 아마 양손으로요."
#,ecotopia,Ecotopia,"요즘 보이는 모든 것이 탄소중립적이고, 재활용되었으며, 100% 유기농 삼으로 만들어졌거나 혹은 그런 것들로 만들어진 것 같아요. 지도자님께서는 환경운동의 진정한 영웅이 되셨어요. 재활용 플라스틱으로 만들어진 멋진 녹색 동상이 기다려지네요."
#,wrappedintheflag,Wrapped In The Flag,지도자님만큼 우리 나라 국기를 사랑할 수 있는 사람이 있을까요? 분명 우리 나라의 50%는 지금 깃발 아니면 깃발로 인해 생겨난 그늘에 가려져 있을 거예요. 지도자님 덕분에 이 위대한 나라의 주민인 게 자랑스러워요.
#,bulletproofpolitics,Bulletproof Politics,슈퍼히어로가 지도자님으로 변장한 건가요? 아니면 우리가 익히 들은 방탄 속옷인가요? 어느 쪽이든 암살자의 총알이 목표를 이루지 못했다는 게 놀라울 따름이네요.
#,intergalacticsocialism,Intergalactic Socialism,"오늘날 칼 마르크스가 살아있다면, 분명히 그는 지도자님께서 행하신 사회주의를 위한 공헌뿐만 아니라 지구촌에 사회주의를 전파하려는 지도자님의 계획을 듣고 기뻐할 거예요. 이제 달과 화성에서 최초의 사회주의 공화국이 되는 일만 남았어요!"
#,academicparadise,Academic Paradise,"요즘 사람들은 '테크노크라시'와 같은 용어를 써요. 최고 고등 교육을 받은 인구를 양성하기 위한 지도자님의 놀라운 노력을 묘사하기 위해서 그런대요. 그 공로는 정말로 대견스럽고, 가치 있고, 훌륭한 거예요. 아마 또 다른 긴 단어들도 많이 있을 걸요?"
#,ignoranceisbliss,Ignorance Is Bliss,"어떤 사람들은 현대 사회가 숙련된 노동력 없이 단순하게 돌아갈 수 없다고 주장했지만, 지도자님께서는 그들이 틀렸다는 걸 증명하면서 비평가들을 다시 한번 놀라게 하셨죠. 우리는 어느 지역보다 문맹과 무지의 수준이 가장 높지요. 멍멍꿀꿀!"
#,fooddrugsalcohol,Food! Drugs! Alcohol!,"요즘 우리 주민들이 좋은 걸 즐기는 것 같아요. 그게 술, 담배, 마약인지 아니면 그냥 도넛인지 모르겠지만요. 아니면 위스키로 반죽해 튀긴 도넛에 코카인 가루를 살짝 뿌려먹는 걸까요? 으으으음..."
#,apocalypsenow,Apocalypse Now,우리는 더 이상 블록버스터 재난 영화를 예매할 필요가 없을 것 같네요. 왜냐하면 훨씬 더 인상적인 재난 영화가 TV 뉴스에 나오고 있으니까요. 종말로 치닫는 재난과 사건들을 끝없이 볼 수 있으니 좋지 않나요? 이리와서 팝콘 좀 드세요!
#,festivaloffirearms,Festival Of Firearms,"지도자님께서는 총을 사랑하지 않는 사람은 절대 믿을 수 없는 세상을 만드셨어요. 우린 지금 우리 나라의 개, 고양이, 사람, 새를 합친 것보다 더 많은 총을 가지고 있지요. 드디어 총 1등이네요. 그런 의미에서 배그하러 가시죠."
#,theallseeingstate,The All Seeing State,"분명 숨길 것이 있는 사람들만이 국가의 시선을 두려워하는 거예요. 그래서 우리가 항상 거의 모든 사람들을 감시한다는 것은 좋은 일이고, 전혀 소름끼치지 않아요. 아뇨, 안 무서워요. 아, 아니라고."
#,squeezetherich,Squeeze The Rich,"지도자님께서는 부자들을 각별히 사랑하지 않는다고 하실지도 모르겠지만, 그들을 끝내주게 꽉 쥐어짜는 걸 즐기시죠. 그들을 쥐어짤 때마다 돈이 흘러 나오니까 돈이 안 드는 취미인 것 같아서 좋네요. 껄껄."
#,subsidysam,Subsidy Sam,"♬만약 지도자님께서 무언가를 하고 싶다면, 보조금을 지급해야 하지요♪... 국가에 이 가사를 추가할까요? 아, 국가 개사에도 보조금을 지급해야 하죠? 성과 설명을 작성하는 것에는요? 오, 이건 괜찮은 생각인 것 같기도..."
#,infrastructureaddict,Infrastructure Addict,"미래를 위한 투자의 모든 것! 위인들은 나무를 심는다고 하지만, 그들은 그늘에 절대 앉지 않았죠. 마찬가지로 이러한 대규모 인프라 프로젝트의 그늘에도 앉지는 않겠지만, 이런 일은 여전히 올바른 일이에요."
#,nosaladleftbehind,No Salad Left Behind,"만약 한 사회를 '무엇을 먹는지'로 판단할 수 있다면, 우리 사회는 녹색이고, 건강하며, 유기농이고, 비타민이 풍부하며, 매우 낮은 푸드마일로 잘 표기될 거예요. 진짜로 먹거리가 그만큼 푸르다는 거지, 나라가 정직하다는 걸 비유하는 게 아니에요..."
#,workerswonderland,Workers Wonderland,"우리 나라에서 직장인의 삶만큼 놀라운 삶이 없는데, 어떤 바보가 사장 노릇을 하며 시간을 낭비하려 하겠어요! 짧은 근로 시간, 높은 임금, 그리고 몇몇 매우 기분 좋은 근로 여건은 우리 나라를 직장인들의 천국으로 만들었지요."
#,topmarx,Top Marx,"만약 칼 마르크스가 오늘날에도 살아있다면 바로 우리 나라의 시민권을 취득하려고 할 것 같네요. 우리는 너무 자본주의적인 것들을 대부분 금지하면서, 지구상에 사회주의 천국을 건설했지요. 각자와 우리의 필요에 따라서요."
#,startyourengines,Start Your Engines,"우리가 원하는 게 뭘까요? 차죠! 마시는 차를 말하는 걸까요? 아뇨 자동차죠! 지도자님께서는 아마 우리를 자동차에 진심인 편이라고 생각하겠지만, 누가 그렇지 않겠어요! 도로, 차고, 자동차 전시장이 즐비하지 않은 곳이 있다면, 그것 참 신비로운 일이네요."
#,anythinggoes,Anything Goes,"우리 나라는 거의 모든 사람들이 좋아하는 것을 할 수 있는 '거친 서부'로 명성을 날렸지요. 도박, 마약, 권총, 매춘, 동성애에 대한 우리의 느긋한 태도는 이제 세계적으로 유명해요."
#,praisethelord,Praise The Lord,주님을 찬양하세요! 우리 나라에 은혜를 베푸사 진정으로 경건함 그 자체가 되게끔 역사하셨으니까요. 더 중요한 것은 우리가 학교에서 진화론에 대한 헛소리를 가르치지 않고 믿음을 지킬 수 있게 되었다는 것이죠! 아멘.
#,siliconparadise,Silicon Paradise,"이 텍스트가 로봇에 의해 쓰여지지 않았다고 100% 확신할 수 있나요? 누가 알겠어요! 괴짜와 로봇을 위한 이 테크노토피아에서는 모든 것이 가능한데요 뭘. 자, 지도자님의 흥분 회로를 준비하시고, 위윙- 하고 작동하는 동안에 새 시대를 클릭하세요."
#,successfulliar,Successful Liar,"카메라를 향해 미소 짓고, 지도자님의 성명서를 일반 대중들에게 진심 어리고 진솔한 목소리로 약속하세요. 모든 약속을 어기고도 여전히 선거에서 승리하는 것은 진정한 기술이 필요한 일인데 정말 대단하시네요. 축하드려요!"
#,strongarmofthelaw,Strong Arm Of The Law,"주민들을 두려워 하지 마세요! 지도자님께서는 거리마다 경찰차, 자전거, 드론, 그리고 경찰관이 있는 지구상에서 가장 법을 잘 지키고 잘 집행하는 국가에 살고 있기 때문이죠. 거리는 안전하고, 국가가 지도자님을 보호할 거예요!"
#,secretstate,Secret State,"네 맞아요. 우리가 아주 비밀스럽고, 모든 사람들을 감시하고 있으며, 의심스러운 법 집행 체계를 사용하고 있다는 소문이 있어요. 하지만 모두 유언비어일 뿐이죠. 주민들의 풍문을 귀담아 듣지마세요. 지도자님께 무엇이 좋은지 알고 있다면..."
#,healthyliving,Healthy Living,지도자님! 기분이 좋으세요? 저도요! 인생은 환상적이지 않나요? 요즘 우리 모두가 건강한 삶을 사는 것은 정부가 국민들의 건강에 집착한 덕분이라고 생각해요.
#,gravediggingboom,Gravedigging Boom,"아들아, 요즘 돈을 벌고 싶다면 묘지 파는 일을 하렴. 그래! '신나는 땅굴 시장'에 참여하는 모든 사람들이 많이 재미보고 있단다. 다들 배후에서 총을 꼭 쏠 것이기 때문이지."
#,spotlightjunkie,Spotlight Junkie,"못 믿으시겠지만, 지도자님께서는 이번 주말에 또 시간을 내주셔야 겠어요. 나라를 통치하기 위해서요. 언론에 계속 나가시는 것이 지루하고 거슬리시겠지만 필요한 일이에요. 이것도 일의 일부가 되어버린 것 같아서 걱정되네요."
#,childrenareourfuture,Children Are Our Future,"솔직히 말해서 우리 모두는 우리의 삶을 완전히 엉망으로 만들었지만, 우리가 한 모든 행동이 다음 세대를 위한 일이었다며 허세를 떨 수 있어요! 다음 세대는 우리가 그들을 위해 희생한 것에 대해 우리에게 고마워할까요? 참, 착각도 자유죠."
#,ruraltranquility,Rural Tranquility,"아... 새들이 지저귀고 나뭇잎이 바람에 살랑살랑 흔들리는 부드러운 소리... 우리 나라의 도시는 완전히 지옥 같은 곳일 수도 있지만, 지도자님 덕분에 시골만큼은 환상적인 곳이 되었다는 점에 모두가 동의하고 있어요!"
#,unitednations,United Nations,"요즘 각국 외교관들과 등을 토닥이고, 박수 치고, 악수하는 것을 고민이라고 하기에는 힘들죠. 우리나라는 국제 협약에서 최정상의 위치이며, 그 어느 나라에도 뒤지지 않는 명성을 가지고 있으니까요."
#,shufflemeister,Shuffle-Meister,지도자님께서는 언제 결정을 내리실 건가요? 마음에 드는 사람이 있긴 하신 건가요? 솔직히 장관 임명식을 이렇게 자주 하시려면 모든 장관실에 회전문을 설치하는 게 낫겠어요.
#,lonelyatthetop,Lonely At The Top,"장관 한 명을 잃는 것은 불행하게 느껴질 거예요. 지도자님의 경력에서 많은 것을 잃는 느낌이 들겠죠. 그러나 이 또한 눈부신 가치가 있으며, 동정심과 신기함, 그리고 아마도 게임 내에서의 성과 같은 새 느낌으로 다가올 거예요."
#,marginoferror,Margin Of Error,"와, 선거날 밤 TV를 짜릿한 구경거리로 만드셨네요. 정치 전문가들 중 그 누가 그렇게 접전인 상황에서 선거 결과가 어떻게 나올 거라고 생각하겠어요. 편안하게 마음먹으세요."
