#,leaderdiessuddenly,지도자 급사,"정부 지도자가 예상치 못한 상황에 급사했습니다. 중증의 심장마비를 겪고 다시는 일어나지 못했다고 합니다. 각하께서 권한대행으로 차기 선거까지 정부를 이끌게 되셨습니다."
#,leavingtheunion,연합 탈퇴,"이전 정부에서 시행된 국민투표 결과를 이번 정부가 넘겨받았으니 국민의 뜻을 따라야 할 때입니다. 그동안 우리나라는 주요 무역상대국이 포진한 연합에 잔류해야 하는지를 두고 나라가 두 쪽으로 갈려 논쟁을 벌였습니다. 아주 미세한 격차로 유권자들은 국가 연합을 탈퇴하자는 결정을 내렸습니다. 우리나라의 법, 헌법, 시장 모두가 연합과 너무나도 얽혀있어 탈퇴는 정말이지 행정작업만 해도 까마득한 과업처럼 보입니다. 하지만 탈퇴가 정확히 무엇을 의미하는지 아직 정해지지 않은 만큼, 이건 앞으로 정치적인 이득을 가져올 수 있는 좋은 기회가 될지도 모릅니다."
#,lowcorruptionpraised,높은 국가청렴도,"한 국제보고서가 우리나라를 대륙 내에서 가장 부정부패가 적은 국가 중 하나라고 밝히면서 우리사회가 매우 높은 청렴도를 보이는 바람직한 상태라 평가했습니다. 청렴한 사회에서는 기업활동이 번창할 수 있으며 우리 국민들이 부패에 발목잡히지 않고 더 나은 삶으로 나아갈 수 있습니다. 국제사회도 국내투자가 목적에 알맞게 효율적으로 사용될 것이라 신뢰할 수 있을겁니다."
#,martyrdies,분신 열사,"우리나라 수도에서 한 시민이 분신으로 정부에 항의하는 극단적인 선택을 했습니다. 분신으로 전신에 큰 화상을 입고 병원으로 옮겨졌지만 끝내 숨졌습니다. 열사의 희생을 기점으로 시민 불복종이 전국적으로 확산하면서 정세 불안을 야기하고 있습니다."
#,masssentencing,집단선고,"법원에서 공정한 재판의 국제 기준을 정면으로 위반하고 수백 명의 피고인을 단 한 번의 공판만 거친 뒤 선고를 내리는 사태가 일어났습니다. 각 개인의 사건에서 실체적 진실을 발견하기가 불가능할 수 밖에는 없는 이러한 재판 방식은 사법 정의를 유린하는 것입니다."
#,migrantsdieintruck,트럭 내 이민자 참변,"국경을 넘어온 냉동트럭 화물칸에서 수십 구의 시신이 발견되었습니다. 희생자들은 외국인 이민자들로 트럭을 타고 우리나라에 입국하려다 안에서 질식사한 것으로 확인되었습니다. 이번 참사를 두고 국경순찰 미비로 이러한 시도를 제대로 적발해내지 못한 정부와 이렇게 필사적으로 떠나온 사람들의 합법적인 입국을 불허하는 고질적인 현 상황에 비난이 집중되고 있습니다."
#,militarycontractscandal,방산비리 논란,우리 군의 제도화된 부패가 전국신문의 보도를 통해 드러나면서 조사가 시작되었습니다. 조달계약서를 조작해 막대한 국방예산을 개인 계좌로 빼돌려 왔다는 것입니다.
#,minerskilled,광부 참변,"광산 갱도 안에서 광부 수십명이 사망하는 참사가 일어났습니다. 현재 시설의 산업보건안전기준 준수여부를 조사하고 있지만, 여론은 이미 한참 늦은데다 턱없이 모자란 조치라는 평가입니다."
#,multinationalcompanyheadquarters,다국적기업 지역본부 유치,"한 다국적기업이 우리나라에 지역본부를 설치하기로 결정했습니다. 기업에게 우호적인 노동시장과 높은 교육수준, 제도적인 안정성 모두가 이번 성과에 상당부분 기여했다는 평가입니다. 앞으로의 고용과 경제지표에 긍정적으로 반영될 가능성이 높아 보입니다."
#,nationalcyberattack,전국적 사이버공격,"우리나라의 핵심 전산시스템이 대규모 사이버공격을 받았습니다. 은행, 언론사, 정부 웹사이트를 표적으로 한 이번 공격은 해외에서 좀비PC를 모아서 구성한 봇넷을 통해 서버에 비정상적으로 많은 요청을 보내 표적 서버를 마비시키는 이른바 디도스 공격 방식을 이용한 것으로 확인되었습니다. 전부터 이와 유사한 도발을 주변국에 해왔던 국가가 이번 공격의 배후에 있음이 분명하며, 애국자들은 즉각 격앙된 반응을 보이고 있습니다."
#,nationalsportsstarsgaggedbyforeignpower,외국열강에 입막음당한 스포츠 스타,"스포츠도 결국 사업인만큼, 선수들은 자기 생각을 말로 꺼내기 전에 계약서부터 확인해봐야 합니다. 그러지 않았다가는 자국 내 시위에 대한 지지선언에 적대적으로 반응하는 초강대국에게 굴욕적인 사과문을 발표하게 되니 말입니다."
#,nationalteambanned,국가대표팀 출전금지,"우리나라 축구 국가대표팀이 상대 선수에게 인종차별적인 발언을 했다는 이유로 잔여경기 전체 출전을 금지당했습니다. 현재 우리사회의 인종갈등은 매우 고조되어있는 상태이며, 모두의 이목을 집중시킨 이번 징계가 우리 사회의 부끄러운 민낯을 드러냈다는 평가가 나옵니다."
#,nationalteamdefects,국가대표팀 망명,"축구 국가대표팀이 국제대회 출전 이후 귀국을 거부하고 있습니다. 대표팀은 현재 개최국에 망명을 신청한 상태로, 귀국시 생명에 위협을 받을 것이라 주장하고 있다고 알려졌습니다. 이번 사건은 우리 사회의 광범위한 문제점을 드러내는 국제망신이 아닐 수 없습니다."
#,nationalteamexitsworldcup,국가대표팀 월드컵 조기탈락,"축구 국가대표팀이 기대보다 일찍 조기 탈락하면서 월드컵을 마치게 되었습니다. 국민들은 실망감을 감추지 못하는 분위기입니다. 언론에서 대표팀 선수들이 거센 비판을 받고 있고, 전국적으로도 우울한 분위기가 감돌고 있습니다. 경쟁력있는 스포츠 팀도 꾸리지 못하는데 어떻게 글로벌 리더의 포부를 가질 수 있겠느냐 하는 말까지 나옵니다."
#,nationalteamwinsworldcup,국가대표팀 월드컵 우승,"우리 축구 국가대표팀이 월드컵에서 우승해 전국의 축구팬들에게 기쁨을 안겨주었습니다. 월드컵 우승이 장기적으로 뚜렷한 이익을 가져다 주는 것은 아닐지 몰라도 우리 국민들 사이에서 호의적인 분위기가 퍼져나가고 있는 점은 크게 환영할만한 일입니다."
#,nativespeciesextinct,토착생물종 멸종,"흔히 볼 수 있던 토착 생물종 중 하나가 절멸 선언되었습니다. 자연 서식지의 파괴와 밀렵이 원인으로 지목됩니다. 환경주의자들은 정부가 우리나라의 자연환경을 보호하지 못하고 있다며 크게 분노하고 있습니다."
#,naturallyentertaining,자연생태 다큐멘터리 대히트,"우리나라의 유명 생태학자들이 또다시 해냈습니다. 이번에 방영된 생태 영상 다큐멘터리 시리즈가 세계적인 대히트를 쳐냈고, 이에 전지구적으로 시급한 생태계 문제에도 관심이 높아지고 있습니다. 또한 전세계에 다큐멘터리를 통해 방영된 장면들이 우리나라의 이미지로 각인되면서 국가 인지도도 상승하고 있습니다. 환경단체의 회원수도 상당한 증가폭을 보이고 있습니다."
#,newlyindustrializedcountrystatus,신흥공업국 진입,"국제적으로 경제학자들이 우리나라를 신흥공업국으로 분류하기 시작했습니다. 이는 우리의 강력한 정치적 지도력, 제조업 성장, 도시화, 자유무역 면에서의 성취를 인정하는 것입니다."
#,nobelpeaceprize,노벨평화상,국내외적으로 민주주의 발전에 크게 기여해온 이들에게 노벨평화상이 주어졌습니다. 이는 우리의 민주주의 체제에 대한 국제사회의 강력한 지지를 나타내는 것입니다.
#,olympichosts,올림픽 개최,"국제적인 리더십을 나타내는 데에는 아무 문제 없이 치러진 성공적인 올림픽 개최만한 것이 없습니다. 페어플레이와 명예라는 올림픽 선서의 메시지를 우리나라의 이름으로 전 세계의 관중들 앞에서 발표하는 것은 분명 올림픽 유치에 들인 비용과 수많은 악수로 이루어진 막후협상의 값어치를 한 것 같습니다. 선수들도 분명 즐거운 시간을 보냈으리라 확신합니다."
#,openlygayleader,공개적인 동성애자 지도자,야당의 신임 당대표로 공개적인 동성애자 정치인이 선출되었습니다. 이렇게 동성애자가 정계 최고위직까지 진출하게 된 것은 우리 사회의 성소수자 차별을 개선하려는 지속적인 노력이 있었기에 가능했다는 평가입니다.
#,oppositionmembersstagewalkout,야당의원 집단 항의퇴장,야당 국회의원들이 정부가 민주적 절차를 억압하고 있다고 항의하며 집단 퇴장했습니다. 야당의 참여가 없다면 민주주의는 허울조차도 지킬 수 없을 것입니다.
#,oppositionplanswithdrawal,야당 투표참관 거부 계획,"야당 일각에서 전례없는 선거조작 의혹에 항의하면서 차기 선거에서는 무의미한 투표소 참관인 선정을 거부하겠다고 밝혔습니다. 이번 부정선거 의혹이 야당의 선거 패배 원인으로 몰리면서 야당 적극지지층 사이에서는 격렬한 반응이 터져나오고 있습니다."
#,parkrangerkilled,공원 관리인 피살,오늘 공원 관리인이 근무중에 무장한 밀렵꾼들을 제지하려다가 피살당하는 사건이 발생했습니다. 암시장에서 멸종위기종이 너무 높은 가격에 거래되다 보니 밀렵꾼들이 살인까지도 서슴치 않게 된겁니다.
#,pipelineprotests,송유관 건설 반대시위,"원주민 거주지역을 가로지르는 송유관 건설이 거센 반발을 불러일으키고 있습니다. 반대시위에서는 송유관 건설이 환경에 미칠 영향을 크게 비판하고 있으며, 국제적으로도 많은 지지와 관심을 받고 있는 상황입니다."
#,planecrash,비행기 추락사고,"국책항공사의 비행기가 추락해 탑승객 전원이 사망했습니다. 항공기 시스템 고장의 원인으로는 정비 불량이 꼽히고 있으며, 허술한 안전기준을 두고 정부에도 비판이 이어지고 있습니다."
#,poachersconvicted,밀렵꾼 유죄 확정,"공원 관리인에게 붙잡힌 밀렵꾼들이 재판에서 유죄를 선고받았습니다. 우리 자연환경을 보호하는 공원 관리인들의 헌신은 찬사를 받아 마땅하며, 정부의 필수장비 지원이 없었더라면 밀렵꾼 체포는 불가능했을 것이라는 말도 나옵니다. 그러나 밀렵활동은 우리 사회의 빈곤 문제가 만들어낸 병폐인만큼 근본적인 원인 제거에 나서야 한다는 지적도 나옵니다."
#,policeshooting,경찰 총격사고,"경찰이 비무장 상태의 시민에게 총격을 가해 사망하는 사건이 발생했습니다. 피해자는 소수인종으로, 이번 사건은 소수인종 사회에서 분노를 불러일으키고 있습니다. 진보주의자들은 차별적인 경찰 폭력을 끝내자는 구호를 들고나온 사회정의 집회에 지지를 보내고 있습니다."
#,politicalrelationshipdowngraded,정치적 관계 격하,"주요 무역상대국에서 우리나라와의 정치적 관계를 격하시켰습니다. 이는 최근 양국간 외교관계의 난맥상에서 기인한 극단적 조치입니다. 대외무역과 투자와 같은 경제협력이 상당부분 중단되는 등 우리 경제에 타격이 있을 것으로 예상됩니다."
#,politicalrelationshipupgraded,정치적 관계 격상,"주요 무역상대국에서 우리나라와의 정치적 관계를 격상시켰습니다. 최근 양국간 외교관계가 급진전하면서 대외무역과 투자도 크게 확대되고 있습니다. 이번 공식적인 관계 격상이 우리 경제에도 활력을 불어넣어줄 것으로 기대되고 있습니다."
#,protesterskilled,시위대 사망,"정치집회 도중 무장경찰이 진압에 나서면서 시위대 수십명이 사망했습니다. 집회의 합법성 여부와는 별개로 이러한 잔혹한 진압은 매우 비민주적이며, 국내 여론 뿐만 아니라 국제사회에서도 비난이 쏟아지고 있습니다. 앞으로 정국 불안정이 더욱 심화될 것이라는 관측이 나옵니다."
#,quantumcomputing,양자 컴퓨팅,국내 기술기업이 컴퓨터 기술의 새 시대를 열었다고 발표했습니다. 양자 프로세서는 병렬연산 수행을 위해 복잡한 과학원리를 이용합니다. 기존의 컴퓨터에서는 수천 년이 걸리는 각종 작업들이 몇 분만에 끝나게 할 수 있는겁니다. 이제 기술분야의 시장 주도권을 우리나라가 잡고 있다고 해도 과언이 아니게 된 것입니다.
#,regionalwar,국지전 발발,"이웃 국가간 전쟁이 발발해 인근 우리국경에서도 긴장이 고조되고 있습니다. 현재 수많은 난민 유입과 무역량 감소를 목도하고 있는 상태입니다. 인접국간의 갈등이 우리나라의 안정성에도 악영향을 미칠 수 있다는 우려도 나옵니다."
#,resourcesobsolete,자원산업 쇠퇴,"국내 광산에서 채굴되는 광물의 수요가 전 세계적으로 감소하고 있습니다. 제조공정에서 우리 자원을 대체할 수 있는 더 나은 대체자원이 발견되었기 때문입니다. 현재로선 판매가격과 이윤을 줄여 판매량을 지키는 수밖에는 없습니다."
#,richestcompanypaysnotax,거대기업의 조세회피,"세계 최대의 다국적기업이 올해 우리나라에서 수십억 달러의 수익을 올리고도 세금은 단 한 푼도 내지 않아 논란이 되고 있습니다. 회계기준을 최대한 악용하고 최고의 역외 조세피난처를 이용하는 식으로 타의 추종을 불허하는 수준의 조세회피를 자행해 우리 정부에 필요한 공공자금을 갈취하고 있는 것입니다. 사회주의자들은 이에 크게 분노하고 있고, 애국자들도 우리나라가 외국 법인에 과세를 할 수 없다는 사실에 허탈해하고 있습니다."
#,royalbaby,로열 베이비,"For royalists, thoughts of succession. For everyone else, cute baby photos. When a future monarch is born into our nation's royal family, there's something for everyone. Well, at least something for enough voters that we can pass that tricky legislation without too much press coverage. Smile for the cameras your majesties."
#,royalwedding,로열 웨딩,"There may be some argument over the return on investment in our nation's royal family. However, when you need the electorate to be distracted, you can rely on blanket coverage in the press when there's a royal wedding. Let's not talk about how much the event cost, it's their special day after all."
#,schoolgirlskidnapped,여학생 집단 납치,Hundreds of female students have been kidnapped by terrorists from a government school. The extremists had destabilised the area of our country where the kidnapping took place over a prolonged campaign against our governance Our security resources are not sufficient to take back control and rescue the schoolgirls.
#,schoolshooting,교내 총기난사,"National tragedy has struck. A lone wolf gunman entered school grounds and murdered dozens of students and staff. Without affiliation to a known radical group, it is nearly impossible for security services to pre-empt and prevent shootings like this. Access to fire arms and a lack of mental health service provision has proven a deadly combination, again."
#,scientificbreakthrough,과학적 대발견,"New battery science has been developed in our country that will change the way the world's machines are powered. With double the capacity density, existing products can be redesigned around smaller cells, and new, previously impossible, battery-powered products created. Our government's ability to highly educate domestic scientists and attract overseas talent has paid off."
#,sexualassault,성폭력,There is national outrage as a woman's sexual assault on public transport is widely reported. Violent crime against women is abhorrent. That rape could be committed in public without anyone interceding is a damning indictment of our society. The electorate are demanding that lawlessness and gender inequality be addressed by the government.
#,shareipocancelled,기업공개 취소,"A high profile company has cancelled its stock market debut, choosing to postpone its IPO. This is another worrying example of a wider trend of companies whose public share listings have run into trouble. Investors, who have previously been desperate to place capital in growth shares, are now questioning the valuations of companies that are yet to turn a profit. Concerns over global economic growth hurts the prospects of these companies ever being profitable."
#,shareiposuccess,기업공개 성공,"Our country's latest technology startup success story has listed itself publicly on the national stock exchange. Investors were hungry to buy a piece of the newest company to disrupt traditional markets, seeing shares climb on the first day of trading. This a great indication of the level of technological expertise in our workforce, and a healthy environment for commerce."
#,socialmedia,소셜 미디어?,"An investigation is underway into a data analytics firm, who have deceptively harvested millions of citizens' personal data through social media platforms. Users thought they were taking a fun quiz, but ended up being profiled and influenced by targetted advertising during the last election."
#,socialstupidity,위험천만 SNS 챌린지,"Eating sachets of laundry detergent... Children could be forgiven for consuming the sweet-like soap pods, but this dangerous activity has gone viral amongst teenagers, as social media users challenge one another to chew on the poison. That our youth could act so irresponsibly is a national embarrassment, with calls to refocus our resources on education."
#,spousescandal,배우자 스캔들,"Your spouse has been reported to have taken a private jet to go shopping abroad. As leader of the government, this high profile abuse of power will not be well received by the electorate."
#,statevisitcancelled,공식방문 취소,"A foreign head of state has cancelled their official visit to our country. They blame regional instability and security concerns for their cancellation. This snub makes you appear weak, calling into question our government's ability to maintain order."
#,stickingupfortheenvironment,환경 파괴를 막아세워라,"An environmental protester has breached airport security, and glued themselves to an aeroplane. The flight has been prevented from taking off, and there is widespread disruption at the capital's airport."
#,stormdestroysrailway,폭풍에 철로 파괴,"A key stretch of railway has been destroyed by a fierce storm. Environmental defences were insufficient to protect our core infrastructure, highlighting embarrassing underinvestment by our government, and a lack of oversight."
#,terrorattack,테러 공격,"Our nation's capital has been turned into a war-zone, with a series of co-ordinated terrorist attacks. Suicide bombers drove innocent people into the gunfire of shooters, waiting for them to flee from the explosions. Hundreds of innocent citizens have died, and you were left no option but to declare a state of emergency across the country to fight terrorism. Civil liberties have been suspended, until the safety of the electorate is assured."
#,terroristleaderkilled,테러단체 지도자 사살,"The leader of a terrorist cell has been killed in a drone strike orchestrated by our military. They were taking refuge in a sympathetic nation, complicit in allowing their radical faction to plot and conduct terror attacks against our citizens. Though this is a great day for the continued security and freedom of our country, there are those that consider our methods to be imperialist."
#,tinderbox,불씨,"High winds downed power lines last year, which were the cause of the worst wildfires on record. With storms forecast, power plants have planned outages to prevent another inferno."
#,touristkilledinanimalattack,동물 공격에 관광객 사망,"A tourist has been killed after being attacked by a wild animal. With the large numbers of tourists in close proximity to wildlife in our country, preventing all incidence of attack is impossible. However, a news story like this can only hurt the tourism industry."
#,touristmurdered,관광객 피살,"A tourist has been murdered during a mugging. This story has been widely reported in the international press, shining a spotlight on our nation's social problems. Our lucrative tourist industry is the latest economic casualty of our high crime rates."
#,tradedispute,무역 분쟁,"A major trade war has broken out between two of the worlds largest economies, and sadly we will inevitably get caught in the crossfire. This war of tariffs is mostly for domestic political purposes, but it will still impact our exports, and increase prices of our food imports."
#,undermined,출혈경쟁,"One of our key extraction industries is being undercut by a foreign competitor, crashing the commodity price. The large competitor's capital reserves can absorb the loss they must be making by subsidizing production."
#,unitednationssecretary_general,유엔 사무총장,"One of our prominent diplomats has been appointed Secretary-General of the United Nations. They will become the spokesperson and leader of this powerful, global organization, acting as a world moderator."
#,women_smarch,여성 행진,"Women have flooded the capital to march in protest against gender inequality. Women are under-represented, undervalued, and underpaid in our country. Comprising half of the electorate, this is a dangerous demographic to have stirred into political action."
#,worldheritagesite,세계유산,"An international body has awarded a landmark in our country world heritage status. This award is reserved for sites that have significant cultural, historical and scientific value to the interests of humanity. Our special location will now be legally protected by international treaties, and we expect a large boost in tourism, as the world visits our marvel."
#,xenophobicattacks,외국인혐오 공격,"Rioters have attacked foreign shop owners whilst protesting against immigrant workers taking job opportunities. Foreigners sought shelter from the protesters in places of worship and police stations. Xenophobia against migrants will continue, as unemployment rates cause widespread anger."
#,youngbutnotsodumb,생각마저 어리지는 않다,"Students have amassed to protest against a perceived bait and switch by your government. You campaigned on a platform of equality and social justice for all ages, but have failed to appease the youth."
#,CreditRatingDowngraded,국가신용등급 하락!,"The major international credit agencies have downgraded the status of your governments debt. This is likely to have a knock-on effect on GDP as foreign companies become wary of investing in our economy, and it will also result in the interest rate we pay on our debt rising. there is a good chance this will upset our capitalist voters too. You should take action to regain credibility with the ratings agencies by reducing the level of debt as soon as possible. Your current Credit Rating is now '<CREDITRATING>'"
#,CreditRatingUpgraded,국가신용등급 상승!,"The major international credit agencies have increased the credit worthiness of your government. This is great news! It should result in lower interest rates for our debt, and also may result in a boost to GDP from a higher level of confidence by foreign investors. This news is also likely to please capitalist voters. Your current Credit Rating is now '<CREDITRATING>'"
#,FailedCapitalistAssassination,실패한 암살시도!,"Secret service agents today saved you from a highly organized attempt to assassinate you. A lone sniper, with a high-tech rifle was arrested just 200 feet from where you were planning on meeting some teachers at a school opening ceremony. The assassin has confirmed intelligence service suspicions that he was hired by a top secret group of hyper-rich industrialists known as 'The Battenburg Group'. It seems there are a number of extremist capitalists who want you dead, and your government out of office. Be careful."
#,FailedConservativeAssassination,실패한 암살시도!,It looks like the extremist wing of the conservative 'Traditional Values Alliance' have taken it upon themselves to eliminate you as head of the government. Apparently this splinter group are known as 'The Moral Crusade' and today's bungled assassination attempt will not be their last. You must really be rattling the cages of conservatives to drive them to take actions like this.
#,FailedEthnicAssassination,실패한 암살시도!,"You were woken in a panic this morning by news that armed extremists had made an attempt on your life. A group of armed anti-government protesters, claiming to be from the 'Black Power Group' opened fire on government buildings this morning, breaking windows and injuring some staff, but luckily causing no fatalities. The group accused the government of racism, and said they represented the anger of this country's ethnic minorities. We should be wary of the potential for future such attacks."
