#,FailedFarmersAssassination,실패한 암살시도!,"At 10.21AM today our security people arrested a man trying to get his way into a press briefing with a loaded shotgun. Apparently he was from 'The Farmers Alliance', an extremist group formed to fight government policies on agriculture. Security forces have been watching this organization for some time, and it's clear that as long as government policies do not change, we are going to have to expect more attacks like this. This time, we got lucky."
#,FailedGreenAssassination,실패한 암살시도!,"There has been a failed attempt on your life by a Green Terrorist group known as 'The Green Brigade'. You were lucky that brave members of your intelligence forces managed to intercept them in time. In the future we may not be so lucky, so you might want to review security measures. This is a small fringe group of eco-terrorists, but the more we anger the wider environmental movement, the more attacks like this we will have to expect."
#,FailedLiberalAssassination,실패한 암살시도!,"Apologies for rushing you out of the building in a hurry, but that explosion was an assassination attempt on you carried out by an extremist liberal splinter group known as 'The Freedom League'. They are apparently angry enough about your government's treatment of liberal issues to try and blow you to pieces. Thankfully our security services managed to discover the bomb before it went off. We might not be so lucky next time."
#,FailedPatrioticAssassination,실패한 암살시도!,"Those gunshots you heard in this morning's meeting were no training exercise, but a real live attempt to assassinate you by a group of heavily armed terrorists calling themselves 'The True Way'. Apparently, some sort of ultra-patriotic paramilitary organization, they have recently become more and more aggressive in their criticisms of the government. Today, we managed to catch them before they got any closer. We may not be so lucky next time."
#,FailedReligiousAssassination,실패한 암살시도!,"Secret service earned their pay today, when they arrested a carload of what appear to be religious fanatics planning an attack on you and the cabinet. A van, filled with explosives, and small arms was stopped by our vigilant police, after intelligence intercepted by our security personnel. It seems there are a number of religious extremists determined to remove the current government. This lot called themselves 'The Army of God'."
#,FailedSocialistAssassination,실패한 암살시도!,"Earlier today, our excellent secret service personnel arrested five armed men converging on government headquarters apparently with a plan to assassinate you. We are currently interrogating the men, but so far all we know is that they are part of an extreme left-wing movement called 'The Socialist Army'. If it was not for our brave boys in the security services, you would be in the morgue right now sir..."
#,GainNewDonor,새로운 고액 기부자!,"Your fundraising efforts have managed to attract a new wealthy individual to donate to your future campaign fund. Make sure you keep this donor happy, and pay attention to the groups they sympathize with. If donors become unhappy there is a chance you will lose their vital financial support."
#,LoseDonor,고액기부자 상실!,It looks like you have not been keeping an eye on the opinions of our major financial backers. One of our wealthy donors has just cut their support for our party. This may have an effect on our ability to campaign effectively unless we can find a replacement donor (and keep them...)
#,_MinisterialResignation,장관 사임,One of your ministers has had enough of serving in your government and has stepped down to 'spend more time with their family'. You will have to find someone suitable to replace them as soon as possible.
#,socialmediascandal,소셜미디어 개인정보 유출 스캔들,"An investigation has revealed a shocking abuse of privacy by leading tech companies behind popular social media sites. A lack of decent privacy protections and law enforcement has meant tech companies have freely harvested vast amounts of private information which has then been sold on to the highest bidder. This is a perfect example of one of the dangers of our always-connected lifestyles. Naturally, privacy campaigners are outraged that you let this happen."
