#,BanSecondHomeOwnership,다주택 보유 금지,"The laws of physics dictate that a person can only be in one place at once. So why would people have the need for two homes? With this policy, owning more than one house is outlawed and empty property will be seized by the government, greatly increasing social equality and giving more people a good home."
#,Banprivateeducation,사교육 금지,"To make sure that school kids learn the right things and are not influenced by strange ideas, banning all private schools may be the  right thing to do. Now that no more so called elite schools exist, every kid has now the same chance to learn and become something great, boosting equality in the process, as children from all classes and income levels mix together."
#,Banprivatehealthcare,민간의료 금지,Why should some people enjoy better or experimental healthcare while others have to toughen it out? Banning private healthcare will make sure that no one gets special treatment while everyone gets what is needed for him or her to get well again. Nobody's health should be determined by the size of their bank balance.
#,Tradeunionbansatcompanies,노동조합 제한,"Companies face a lot of challenges in our modern times. Trade Unions often add to these challenges with their demands and needs, so banning these organizations will help the management focus on making the company competitive and maximize earnings. Of course the workers still have their rights, they just have to earn them without the backing of a wasteful institution."
#,Compulsoryworkfortheunemployed,실업자 강제노동,"Everyone receiving unemployment benefits now has to do some work every week or risk a payment cut in their benefits. This includes public beautification, collecting litter and other tasks that do not risk any jobs. The goal is to make use of this major workforce and get people back into a work routine, hopefully resulting in them getting jobs soon. Nobody should expect to live off the state without working."
#,Punitivewealthtax,징벌적 부유세,"There is nothing wrong with wealth as such, but inequality in our society is bad enough that we must be seen to do something to ensure those with the highest levels of income bear their share of the costs of maintaining a healthy society. It is entirely reasonable to set a tax rate that takes away the majority of income above extremely high levels, as this money is so much more appreciated by those on lower incomes."
#,Publictaxreturns,세금신고서 공개,"Unfortunately some wealthy people in our society try to avoid taxes with illegal tax evasion methods. By  making tax returns public, people can now check if someone is using loopholes or abusing the system. This full disclosure  will encourage support of the system, as well as reducing tax evasion and forcing everyone to be able to justify their income."
#,Compulsorylanguagelessons,외국어강좌 의무수강,"Some people just can't be bothered to learn languages on their own in order to improve their chances on the job market or to understand other people from different nations. Compulsory language lessons will force these people to deal with the world outside, improve our attitudes to foreign visitors, and enable us to better deal with foreign companies, all whilst giving us a greater understanding of other cultures."
#,Banforeignchurchservice,외래종교 예배금지,"Misunderstandings can lead to tragedies and nothing has caused more trouble and deaths in the past than religious conflict. The easiest way to prevent further trouble here is to ban foreign church service outright, avoiding further misunderstandings and unrest."
#,Diversityquotasforcompanies,기업 다양성할당제,"A diverse company is a happy and healthy company. Enabling diversity quotas for companies will force companies hire more people from different ethni backgrounds that have the same qualification, easing racial tensions and making companies a place of equal opportunity."
#,Newcarsubsidies,신차 보조금,"New cars are expensive but also cause less strain on the environment, while old and used cars may be cheaper but also cause more pollution. Using new car subsidies will help people buy new cars that are safer and protect the environment while making motorists happy. New car smell for everyone!"
#,Flagsoneverystreetcorner,국기 의무게양,"To boost patriotism and to induce a sense of belonging into people, putting flags of our country on every street corner will help with our national self esteem. It also looks much better than some burger advertisement."
#,Nationalanthematstartofnews,뉴스 시보 국가 방영,Flashy introductions for news shows may look fancy but it's missing the point: These news are for our people in our country. So we should make that clear and add a flair of patriotism and pride by having the national anthem played at the start of the news instead.
#,Nationalanthemsinschool,학교 국가제창,Young people these days have lost all sense of belonging. Starting the day in school with the national anthem will boost their national pride and help disciplining them. They may not always like it but it's good for them.
#,Compulsorychurchattendance,교회참석 의무화,How can you be saved if you don't listen to what is important and how to live your life? Making church attendance compulsory will save many souls and lead to a better life for the majority of our people. Too bad about those that do not believe in the right thing.
#,Forcepoliticalmilitaryreligiousoath,공무원 및 군인 종교선서 의무화,"Adding religion to oaths given in public by our officials and troops will create a greater sense of honor and security to the public, giving them the feeling that what we are doing is the right thing to do. With righteousness on our side, nothing can go wrong."
#,Publicreligiousbroadcasts,공영종교방송,The voice of faith and reason needs to be heard to have an effect. Adding public religious broadcasts will do a great service in countering all the bad influences of modern mass media as well as making people value the right things again.
#,Bandivorce,이혼 금지,The holy institution of marriage was not meant to be severed by anything other than death. Nowadays people divorce for the silliest things and this threatens whole families and the well being of our children even though often husband and wife just have to toughen through the hard part. Banning divorces will give marriage back it's true meaning.
#,Banhomosexuality,동성애 금지,"According to many religious texts, homosexuality is a sin. In order to combat this, banning homosexuality might convince many sinners to get their life back on track and follow the natural order that God intended."
#,Banlowmpgcars,저효율 자동차 금지,"With gas prices climbing constantly and nature being polluted from all sides, banning cars that use too much fuel may be the right step to protect the environment and help with excessive fuel usage. A big street cruiser might look cool, but it's way too expensive and wasteful and should be banned from the streets. What is good for the enviornment is good for society."
#,Mandatorymicrogeneration,자가전력 의무화,"One of the biggest cost factor in our lives these days is electricity and heat. By making micro generation mandatory, every citizen has the task of generating at least a part of his or her electricity by using solar or wind power, depending on their situation and where they live. A big step towards lowering CO2 Emissions."
#,Punitivetaxonsuperstores,대형마트 징벌과세,"Superstores may be convenient for out citizens, but they have many negative effects, they encourage car journeys, rather than supporting local shops, and their dominance is encouraging a society dominated by big business, with no room for the small family owned store. They should be taxed to reflect the harm they do to the fabric of our society."
#,Limitorbancarsincities,도심지 자동차 통행제한,"Cars are a major factor in air pollution, especially in big cities. Adding a congestion charge or outright banning them from cities will help greatly in fighting air pollution in cities and will increase the use of public transportation. It might look a little extreme to ban cars altogether but it's still better than to breathe in all that poison."
#,Closeairportscompletely,공항 폐쇄,"An extreme measure to fight pollution, closing down all airports will have severe effects on trade, foreign relations and tourism but will cause much less pollution and increase the usage of other transportation. In this modern day, we simply cannot turn a blind eye to the damage to the environment that is being done by our air travel industry. Desperate times call for desperate measures."
#,HealthyEatingCampaign,건강식습관 캠페인,"Through cooking shows, advertisements and specials in newspapers and other media, people are encouraged to be aware of what they eat, what the results of unhealthy food are and how to cook a good meal. This raises the overall health of the people while reducing obesity."
#,CyclingCampaign,자전거 캠페인,"This campaign highlights the many advantages that bikes have in our cities. Whether it is to get through heavy traffic with ease, save money for fuel or to help prevent unnecessary pollution, the bike offers many things for many different people, they just don't know it yet."
#,CarPoolingCampaign,카풀 캠페인,"It often takes some encouragement for people to come together and make better use of the resources at hand. Car-pooling is a good example of that, so this campaign will make people realize how fun and helpful it can be to car-pool, all the while reducing traffic congestion. And if you still end up in a traffic jam, you at least have people to talk to while waiting."
#,KeepTheCountryTidyCampaign,꺠끗한 나라 만들기 캠페인,"A campaign in popular media, designed to make people feel guilty about littering. No matter how much a fine on littering may be, this only works if people are being seen. But a guilty conscience will also work when someone is alone, thus making it far more effective in the long run."
#,TourismAdCampaign,관광홍보 캠페인,"Tourism is not only a source of income for many people and businesses, it also strengthens foreign relations. This campaign will run in foreign countries, showing our most beautiful places, important sights to see, wonderful people to meet, tasty beers to drink and maybe even throws in a few free tickets to museums and shows, all in the hopes of attracting more people to visit us."
#,AlcoholAwarenessCampaign,알콜중독 예방 캠페인,"Alcohol can be dangerous, even in moderation. To raise awareness of that, this campaign will show all the trouble that alcohol can get you into, from ruined friendships over accidents and addiction to sickness and death. Certainly not a happy topic, but it is always better to have your mood dampened a little now and stay sober than to suffer big time later."
#,BusinessStartupCampaign,스타트업 캠페인,"Many people have brilliant ideas, yet only a few of them dare to take the steps necessary to set up their own little business around their idea. This campaign will help these people out, informs them what they need to do, where they need to go and what permits they need to get. This will help a great deal and make self employed people happy."
#,YouthPoliticsCouncil,청소년의회,"In any democracy it is of utmost importance to teach our kids how politics work and what can be achieved through it. By establishing Youth Politics Councils, youths can get first hand experience on a local and regional level, see that they can make a difference and perhaps the leaders of tomorrow are being recruited here."
#,NationalArmedForcesWeek,국군의 날 기념식,"Our heroes and protectors need to be recognized. By establishing a National Armed Forces Week, this can be done by celebrating their service for our country, making them feel appreciated and showing the public who these brave men and women are that would risk their lives for our safety."
#,FreeParentingClasses,무료 육아수업,"Having a newborn child can be very taxing and exhausting for new parents. By introducing these free classes, parents can learn how to deal with this situation, how to raise their babies and have a normal life at the same time. It won't make the babies cry less, but it will make the parents more stress resistant and aware, plus they will meet other parents in the same situation."
#,NationalBusinessCouncil,국가경제인협의회,"The establishment of a national business council gives a strong voice to business interests and ensures that the needs of business, both big and small are taken into account. The council serves as a way to promote capitalism and enterprise and get accross the message that the corporate world has much to offer, creates employment and prosperity."
#,SocialJusticeFoundation,사회정의재단,"This policy will establish a foundation that deals with the worries and problems of the poor and under-represented in our country. It will take away some of the worries these people have and gives them a better feeling of being included into society. It won't get them a better life directly, but at least some hope of a better future, and hope is very important to have."
#,SmartMeterProgram,스마트미터 프로그램,"By installing Smart Meters into their homes, people can save money and the environment at the same time, as it will increase the effeciency of energy used. It will take a while to convince everyone of this and it won't cause miracles, but it will save a lot of energy in the long run and help save nature for our children."
#,NeedleExchangeProgram,주사침 교환 프로그램,"Drug addition itself is bad enough already, and dirty or infected needles are an additional danger for drug addicts. To help out, the needle exchange program will help the addicts get clean needles for their needs, while also offering them help in getting clean and living a normal life again. Conservatives may think of this as enabling, but liberals see it as a good way to fight drug abuse in the long run."
#,StampOutRacismWeek,인종차별 근절주간,"One week of the year will be dedicated to embrace cultural and racial diversity, aiming to reduce racial tension. This includes specials in the media, small food markets with delicacies from around the world, community meetings, celebrations and friendly competitions."
#,CompulsoryFoodLabelling,식품표시정보 의무화,"There is plenty of food out there that is not healthy, but companies have found clever ways to obscure that by making it look extra tasty or put the ingredients list in smallest print. This is now over with Compulsory Food Labelling: All foods must now display all the ingredients and additives in it, making it easier for people to choose the food they want to eat while remaining healthy."
#,TradeCouncil,무역위원회,"It has always been a hassle to find trustworthy trading partners in foreign countries. With the establishment of the Trade Council, this will become easier now, as potential trade partners are listed here and make offers themselves. This will increase international trade and boost the economy."
#,CompulsoryForeignLanguageClasses,외국어 의무교육,"To understand their language is the first important step to understand other people. By introducing compulsory foreign language classes, schoolkids are taught a selection of foreign languages early on so they can later use them well. This will reduce racial tension while improving foreign trade and relations."
#,LaborDayBankHoliday,노동절 공휴일 지정,"This makes Labor Day an official bank holiday, thus reminding citizens that it is not all about money in our life. While this will certainly help to increase the happiness of the working class and everyone who wants to have a good time, it will have a slight negative impact on the economy because a day wasted is money lost."
#,CityFarms,도시 농업,"Many people would love to buy fresh produce from farmers directly, but living in the city, this is often a hassle to drive out to the countryside. So why not bring some farmers to the cities directly? This program helps ambitious farmers to establish farms in or around cities so they can be close to their customers and it will get some of the city kids to consider a career in farming."
#,EcoHomeRegulations,친환경주택 규제,"By setting rules and standards for houses towards eco-friendliness, there are many more things to be considered now when building houses. This may cause a hassle for developers and landlords, but it will help protect the environment in the long run."
#,YoungEntrepreneurScheme,청년 기업가 지원제도,"This Scheme is to help and support young people who are aiming to become businessmen in the future. By giving them opportunities to learn from veterans and detailed information about what to do and who to ask, this will increase happiness amongst capitalists, as they see their future secured."
#,DiplomaticService,외교청,"Going beyond just having an ambassador and a secretary in a foreign country, employing a full Diplomatic Service may be more expensive, but in the field of international diplomacy, you need to stay on top of things in order to get the best deals for your country and to keep everyone involved and happy. It may take some time to get working effectively, but it will boost foreign relations."
#,WitnessProtectionProgram,증인보호 프로그램,"What good is catching a criminal if the witness to the crime disappears forever? Protecting these witnesses is of utmost importance for a working justice system, and the better it is, the more criminals get convicted and the more witnesses come forward if they see a crime."
#,CompulsorySchoolSports,스포츠수업 의무화,"By going beyond the physical education once in a week in schools, this program will introduce fully fledged sports classes. Pupils will be encouraged to pick a field they like and train for it, later competing in school tournaments on a local, regional and even national and international level, if they are good enough. This will increase the health of our children."
#,BicycleSubsidies,자전거 보조금,"To encourage people to switch from car to bike, a financial motivation is sometimes needed. By introducing bicycle subsidies, it will now be easier and cheaper for people to buy bikes. And this will result in more people actually using a bike instead of driving a car or staying inside, boosting the health of all citizens by a little."
#,FrequentFlyerTax,항공기 상용고객세,This Tax is charged only for passengers taking multiple flights per year. The idea behind it is to both reduce the amount of air travel (normally for environmental reasons) while still allowing the average-income citizen access to air travel for the occasional holiday.
#,EmptyHomesTax,빈집세,"A tax levied on homes that are mostly left empty, generally second homes owned by the wealthy and used for a month or two each year.  Popular in rural communities where wealthy buyers from other regions push up property prices meaning that many young people and the less well-off cannot afford to buy at all."
#,DivertedProfitsTax,우회이익세,"A tax levied on estimates regarding large companies profits earned in this country, regardless of their actual reporting. This is used to prevent multinational companies from claiming that all of the profits they earn are somehow only generated in a tax haven (with little or no corporate taxes), by using cunning accounting trickery. The tax is mostly designed as an incentive to push such companies to play by the spirit as well as the letter of the law."
#,UniversalBasicIncome,보편적 기본소득,"A universal welfare payment given to everyone in society at a flat rate regardless of their income or wealth. This is seen as a way to simplify welfare bureaucracy as well as provide a universal safety net for all citizens, and pave the way for a reduction in work made possible by automation"
#,StateTelecoms,통신공사,"A state owned and run telecoms company that makes it easy for the government to ensure provision for all, and to subsidize usage."
#,StateWater,수자원공사,"A state owned and run water company that can ensure everyone has access to clean water, even if subsidies are required."
#,StateRail,철도공사,"A state owned and run rail company that allows the government to run public transport at a loss, if so desired."
#,StateEnergy,전력공사,A state owned and run electricity company that allows the government to subsidize energy production if it chooses to do so.
#,MinimumWage,최저임금,"A completely unregulated labor market can lead to wages that trap people in poverty. The government setting a minimum wage addresses this, and reduces inequality, but minimum wages are a market distortion that could push some companies out of business."
#,GayMarriage,동성결혼,"Traditionally, many religions only support marriage between a man and a woman, but more liberal societies are happy to have legally-significant civil partnerships, or even marriages between same sex couples. It's a matter of debate as to whether these should be carried out in churches and by priests."
#,RightToDie,안락사 권리,"Although clearly punishing people for taking their own life is futile, the state often makes it a crime to assist in someone's early death, even if they are in great pain and are unable to carry out the act without help. Religions often take a dim view of suicide, or those assisting in it, regardless of circumstances."
#,RightToPrivacy,프라이버시권,"As more of our lives are led online, and tracking everyone's actions and movements becomes easier, some people argue that the right to privacy both from government and from corporations is essential, despite the impact this would have on corporate profits or law enforcement."
#,GenderTransition,성전환,"Some religious groups, and conservative sections of society argue that there are only two genders, and that changing gender should not be allowed. Others argue that gender has always been fluid and nobody should enforce their gender views on others. Ultimately the state has to take a stance on the extent to which gender transition is officially accepted or rejected."
#,PrisonRegime,교도소 운영정책,"Liberals have the desire to rehabilitate prisoners,  and to ensure they are capable of finding work and avoiding criminal activity on release. Conservatives see prison as a powerful deterrent, where prisoners are punished for what they have done."
#,Reforestation,녹화사업,"As a measure to combat CO2, Tree-planting is relatively uncontroversial. However, some campaigners suggest this is treating the symptom, not the cause, and that CO2 should be reduced at source, not captured afterwards."
#,StateBroadcaster,공영방송,"A state-owned broadcaster can provide impartial and independent news without influence from corporate advertising. This can serve as a defense against biased or fake news, but a compulsory 'TV-tax' is not popular with everybody."
#,WorkersOnBoards,노동이사제,"Unpopular with capitalists, who fear that workers will basically vote themselves higher pay and shorter hours. Socialists and trade unionists see this policy as ensuring a company works for its employees as well as its shareholders."
#,TearGas,최루가스,"Tear gas is a great way to control angry crowds, but can have health effects and is seen as a tool of authoritarian regimes. Tear gas is generally only used as a last resort."
#,RubberBullets,고무탄,Rubber or plastic bullets can be fired by police at protesters and rioters as a (usually) non-lethal alternative to actually opening fire with live ammunition. The use of these weapons is generally seen as an extreme measure.
#,WaterCannon,물대포,"An effective, non-lethal and generally low-risk method of crowd control for protesters and rioters. Water cannons are generally seen as a last resort, and more popular with authoritarian governments than democracies."
#,CarbonCaptureAndStorage,탄소 포집 저장,"A variety of engineering solutions to the capturing of Carbon Dioxide emissions to reduce climate change, from direct-air capture, to methods involving capture at source from existing fossil-fuel power stations."
#,PayrollTax,급여세,"A tax levied on employers in proportion to the salaries paid to employees. Easy to collect and hard to avoid, but can act as a disincentive to employment."
#,BorderWall,국경장벽,"The ultimate anti-immigration policy is to build a physical wall around the country to keep illegal immigrants out. This can be ruinously expensive, but it is a bold and visible example of a government's commitment to border defense."
#,QuantitativeEasing,양적완화,"A form of unconventional monetary policy where the central bank effectively prints extra money and uses it to purchases bonds and stocks. This can spur immediate economic activity but will also cause inflation, and increase the wealth of people who own stocks."
#,HelicopterMoney,헬리콥터 머니,"An unusual policy designed to boost the economy immediately, where the government effectively prints free money and hands it directly to citizens for them to spend. Normally the amount is fixed, and can be  withheld from those on high incomes. Like all money printing it is inflationary."
#,CharityTaxRelief,기부금 세액공제,"A policy designed to encourage the wealthy, or anybody who pays tax, to donate to charity, by deducting some of their charitable donations from their income when calculating various taxes."
,,,
