#,RoadBuilding,도로 건설,"Although environmentalists often argue that more roads just lead to more congestion, not surprisingly this isn't how the motorist who is sat in traffic sees it. Building new roads is a very expensive and very slow process, but some suggest its vital to keep our economy functioning."
#,RuralDevelopmentGrants,농촌개발지원금,"As technology advances and more and more citizens take jobs in our cities, there is a danger that poverty and unemployment will rise to unacceptable levels in the countryside. Rural development grants do distort the free market, but they also support rural businesses and prevent poverty amongst farmers and other rural occupations."
#,SalesTax,부가가치세,"Sales tax is the classic 'regressive' tax, which means it does not take into account the ability to pay. Critics argue that this affects the poor disproportionately and thus increases inequality. Supporters argue that it is relatively easy to collect and affects everyone, and is thus fair. Businesses can be opposed to the administrative burden of the tax."
#,SateliteRoadPricing,위성위치측정식 통행요금체계,An expensive system that requires transponders to be fitted to everyone's car and keeps track of what roads people use (and when). Allows per-road pricing for car usage which gives local authorities fine control over reducing congestion without burdening motorists in more remote rural areas who have no alternative transport system.
#,SchoolBuses,통학버스 보조금,"State subsidies for school buses ensure that every school kid has an efficient, and safe journey to school, whilst reducing the number of short 'school-run' trips carried out by parents, thus reducing traffic on the roads. Parents are also happier knowing that there are proper approved school buses."
#,SchoolPrayers,교내 예배,"Liberals will often argue that the education of our younger citizens should be kept entirely separate from any religious teachings. On the other hand, it's argued that some compulsory prayer in schools is a way of promoting moral values in our children."
#,ScienceFunding,과학기금,"In some countries, the majority of research is funded by private companies. State-sponsored science can be useful for investing in very long-term research projects or those that may not be commercially rewarding. The benefits of state sector research are freely available to the entire population, rather than patented by corporations."
#,SmallBusinessGrants,중소기업 지원금,"The failure rate for small businesses is very high. In the early years of trading, a preferential government grant can be an enormous help to get a new enterprise off the ground. This can lead to a big boost to the economy, but it can also be an expensive policy with no guarantee of good results."
#,SpaceProgram,우주 개발 프로그램,"Invest in your country's efforts to explore space! As well as the purely scientific benefits, a well-funded space program will boost the level of technological expertise throughout the entire economy. It will also unite the country and encourage patriotism."
#,SpeedCameras,과속 카메라,"Speed cameras are an automated way to enforce speed restrictions on our roads, without having to invest a fortune in extra traffic police. Supporters claim they reduce road deaths and free up the police to deal with more serious crime, opponents claim they are a cynical way of taxing the motorist and have nothing to do with safety"
#,StateHealthService,공공의료보험,"Although many citizens would be happy to pay privately for their own health treatment, there is an argument that the state has a duty to provide a minimum level of free health treatment for everyone regardless of income. Health provision can be expensive, so it's a matter of debate as to how much should be spent."
#,StateHousing,공공주택,"Some citizens prefer to own their own homes, but the cost of housing is such that a large proportion of the population live in rented accommodation. State housing is provided, at a reduced rate, to those who cannot afford to pay the market rate. This can be expensive to fund, but the social benefits are also significant."
#,StatePensions,공적연금,"Rather than leave it up to the individual to provide for themselves after retirement, state pensions can guarantee a minimum standard of living for the elderly. Be aware that as life expectancy rises, the cost to the state of paying out pensions increases hugely. The level of state pension may encourage or discourage citizens to save into private pension plans."
#,StateSchools,공립학교,"Free education for all ensures high levels of literacy and can be beneficial to the economy, especially those parts of the economy requiring a skilled workforce. The flipside of this is that state education can be expensive for the government. Capitalists see state education as an unnecessary intervention in the free market."
#,StemCells,줄기세포 연구,"A stem cell is a primitive type of cell that can be developed into most of the types of cells found in the human body. Some scientists claim that stem cell research offers great hope for curing diseases such as diabetes and multiple sclerosis. However, because stem cells are taken from discarded human embryos, many 'pro-life' and religious groups oppose their usage."
#,TaxShelters,조세 피난처,"By not fully taxing the wealth of the super-rich, tax shelters can be a great way to encourage successful entrepreneurs to make our country their home. With an ever-shrinking world, the rich are free to settle wherever they please. encouraging them to live here may mean that they spend their wealth in this country. Such measures can be very unpopular with the poor, who resent paying tax on their much lower earnings."
#,TechnologyColleges,기술 대학,"Technology colleges are 'specialist schools' with a focus on computer literacy, biotechnology and similar subjects. These state-run colleges receive special funding from central government in order to encourage a greater level of technological literacy amongst the future workforce."
#,TechnologyGrants,기술 보조금,"The government can provide state funding to encourage business to invest in new and exciting technologies. Although this helps give us a competitive advantage and can create jobs, it can be argued that its an unnecessary distortion of the market."
#,TelecommutingInitiative,재택근무 추진계획,"Telecommuting, or 'working from home' is seen as desirable because it reduces the pressure on the transport infrastructure, and can be an improvement to people's quality of life. It's also welcomed by parents. This policy offers tax incentives to companies supporting this option."
#,TobaccoTax,담배세,"Despite the failure of tobacco companies to admit it, there is good reason to believe that smoking has negative effects on health. This is used as a justification for taxing tobacco. Cynics point out that the government benefits hugely from a tax on a product it is supposedly against. Health campaigners encourage the tax as a way to encourage a more healthy population"
#,TollRoads,유료 도로,"Toll roads charge motorists to use specific roads (normally major highways). This is a great example of directly applying market forces, by only charging those who use a particular route for the construction and maintenance of that route. Motorists tend to see this as just another form of taxation, whereas commuters appreciate not being charged for roads they seldom use."
#,UnemployedBenefit,실업급여,Unemployment benefit is a state benefit given to everyone who is able to work but cannot find employment. Socialists regard this as a minimum safety net for workers out of work because of the whims of the economy. Some believe that high unemployment benefits distort the market and discourage people from seeking work.
#,UniversityGrants,대학 지원금,"Although not all citizens will pursue a university education, governments can provide subsidies to students to encourage a more educated workforce. University grants also ensure equality of opportunity, as in their absence the cost of a university education can be beyond the reach of working class families."
#,WelfareFraudDept,복지 부정수급 조사부,"When government gives so much money out in welfare payments, it's essential that the money is correctly targeted and not exploited by people making spurious claims. A dedicated fraud department will detect false claimants, recover lost money and reassure middle income tax payers that their taxes are being spent wisely, although it can antagonize legitimate claimants."
#,WinterFuelSubsidy,난방비 보조금,A special concession given to the elderly. This is a regular welfare payment made to everyone over retirement age towards the cost of their winter fuel bills. It is designed to reduce 'fuel poverty' which can occur when some elderly members of society cannot afford to heat their homes in winter.
#,WorkSafetyLaw,산업안전법,"Work safety law, often known as 'health and safety' is a series of measures to ensure employees are not at risk from injury in their day-to-day activities. Trade unionists often hail such laws as a valuable defense against unscrupulous employers who may put lives at risk. Many business leaders are concerned at the high levels of bureaucracy and restrictive practices that can result from such laws, which they see as a burden on business."
#,YouthClubSubsidies,청소년센터 보조금,"Free youth clubs ensure that teenagers have a 'place to go' which can help them to stay out of trouble, and in the long run, reduce the incidence of street crime. It can be resented by some wealthier taxpayers, who see it as an unnecessary expense, paid for by their taxes."
#,AbortionLaw,낙태법,"Few areas of policy incite stronger emotions that the debate over abortion. On the 'pro-life' side, are arguments about the rights of the unborn child, and arguments are often made from a  religious standpoint. On the 'pro-choice' side, there is the argument that the State should not have more say over what a woman does with her body than she does. Making any change to the States position on abortion requires a hefty amount of political capital."
#,RentControls,임대료 규제,"An alternative to state-housing is a system where the state will regulate the private-rental market in a bid to ensure the supply of affordable housing for all, even within the private sector. Capitalists will naturally see this as a distortion of the free market that will prevent enough homes being built, whereas supporters will say it prevents exploitation of the poor by greedy landlords."
#,SchoolVouchers,교육 바우처,"A measure designed to encourage the growth of private schooling, whilst still enabling everyone to afford an education. School  vouchers are issued by the state to parents for each child which they can then spend in the private sector on education. This is a different approach to pure state schooling because with school vouchers the schools are privately run and the teachers are no longer state employees."
#,OilDrillingSubsidy,석유 시추 보조금,"To encourage investment in new oil and gas drilling, and thus raise the supply of fossil fuel energy for the country, these tax breaks effectively subsidize fossil fuels. This will indirectly reduce fuel prices and stimulate the economy, but will be an outrage to environmentalists."
#,MansionTax,고급주택 보유세,"A special high rate of tax charged annually on the ownership of super-expensive homes. This tax is popular with some because it is almost impossible to avoid, as homes cannot be easily hidden. It is perceived as unfair by some elderly people who may have expensive homes but relatively low incomes, and thus have difficulty in paying the annual tax. It is a form of wealth-tax, as opposed to income tax."
#,FuelEfficiency,자동차 연비 규제,"Mandatory standards for new cars which dictate the minimum level of fuel efficiency. This is a long term measure aimed to raise the fuel efficiency of the country's cars, and thus reduce our dependence on oil, as well as reducing the cost of driving over the long term. It will be unpopular with car manufacturers, but a hit with environmentalists."
#,ForeignInvestorTaxBreaks,외국인투자 조세감면,"Special tax breaks given to large foreign-owned multinational companies to encourage them to invest in our country. This could include tax-free periods, introductory rates of corporate tax, and straight subsidies to encourage investment. Helps to encourage investment from overseas, but will be seen as incredibly unpatriotic, and pandering to the whims of huge foreign capitalist organizations."
#,RoboticsResearch,로봇공학 연구지원금,"A special grant to encourage research in robotics. Robotics is a very long term area of research which will eventually bring about vast boosts in productivity, but at the same time it will reduce the amount of low or semi-skilled jobs in the economy, and thus potentially lead to higher unemployment."
#,PrivatePrisons,민영 교도소,"Rather than directly control and manage a State prison service, this policy allows prisons to be privately owned and managed, and merely paid for by the state. Private prisons could result in lower cost and higher efficiency. These measures will be unpopular with trade unionists. Liberals will have ethical concerns about profiting from incarceration, but still be pleased if spending is high enough to promote rehabilitation."
#,JunkFoodTax,정크푸드세,"A punitive tax rate charged on unhealthy food such as takeaway hamburgers, fizzy drinks and high sugar or fat content pre-processed food. Levied with the aim of improving the health of the nation, but can be unpopular."
#,HealthFoodSubsidies,건강식품 보조금,"A tax incentive that makes healthy food, such as fruit and vegetables, cheaper than the higher fat or higher sugar foods. Seen as an incentive to eat well, rather than a punishment for eating badly, and thus less punitive on the poor than a 'fat tax'."
#,Tasers,테이저건,A non-lethal but still highly effective (and possibly dangerous) weapon which effectively gives criminals an electric shock. Supporters say it is a good compromise between the need to disable violent criminals and the risk of death associated with traditional firearms. Opponents claim that the use of such weapons lowers the barrier-to-use for the police and will encourage more casual use of force against the population.
#,PoliceDrones,경찰 드론,"Unmanned aerial reconnaissance vehicles, similar to remote control planes which can be employed by the police force. The 'eye in the sky' is a useful way to keep track of mobs and rioters, and allows for subtle yet effective surveillance. The police see it as a vital tool for modern crime fighting, but there are concerns that this is a step further towards a big-brother style surveillance society where everyone is tracked."
#,ArtsSubsidies,예술 보조금,"Investing public money in the arts is controversial with capitalists who see it as supporting uneconomic elitist entertainment, but others see it as vital to a countries culture, boosting our image on the world stage, and attracting tourists."
#,HealthcareVouchers,의료 바우처,"A measure designed to encourage the growth of private health care whilst still enabling everyone access to it. Healthcare vouchers are  issued by the state to everyone but can then only be spent in the private sector on health care. This is a different approach to pure state health care because with healthcare vouchers, the hospitals are privately run and the medical staff are no longer state employees."
#,HealthTaxCredits,의료비 세액공제,"A system of tax-reductions and credits designed to encourage people to spend their money on private healthcare, in order to reduce their tax liability. This boosts healthcare without involving the state running hospitals or employing doctors, but it's effect is limited to those people in society earning enough to be paying tax in the first place."
#,SchoolTaxCredits,교육비 세액공제,A system of tax-reductions and credits designed to encourage people to spend their money on private education in order to reduce their tax liability. This boosts private schooling without involving the State running schools or employing teachers but it's effect is limited to those people in society earning enough to be paying tax in the first place.
#,FoodStamps,식료품 구매권,"Food stamps is a system where the state will issue vouchers or 'stamps' to those citizens on low or no income, to ensure they are able to afford food. Unlike giving a straight cash benefit, food stamps can only be redeemed for uncooked food, preventing them being used for unhealthy takeaway food. Supporters see food stamps as a valuable way to ensure nobody goes hungry, no matter their income. Critics consider such a scheme patronizing, and no more than papering over the cracks caused by free market failure and low wages."
#,FoodStandards,식품안전국,"A food standards agency is a branch of government dedicated to ensuring the safety and minimum nutritional standards of food supplied within the country. Farmers may regard the agency as an extra layer of bureaucracy and meddling, but public health campaigners see the agency as an essential line of defense between the consumer and unscrupulous food producers looking to cut costs."
#,EnterpriseInvestmentScheme,기업투자제도,"The Enterprise Investment Scheme is a system which gives tax breaks to wealthy individuals who invest their money in small startup companies which are based in this country. The scheme encourages investment in companies which should eventually grow and stimulate the economy, whilst at the same time giving a popular tax break to people who invest in them. Obviously indirectly, the scheme is being subsidized by those without savings to invest."
#,RecreationalDrugsTax,오락성 약물세,"In societies that have legalized drugs such as Cannabis and Psychedelics there is a temptation to treat consumption of these drugs as a source of government revenue, given the claims that their consumption should be politely discouraged due to the negative effects on citizens health, in a similar way to governments taxing alcohol or tobacco."
#,HumanCloningResearchGrants,인간복제 연구지원금,"Stem cell research was just the first step. Human cloning is around the corner and our country can be on the forefront of this groundbreaking development. The religious are enraged, but rich prospective parents hope to make the dream of replicating themselves true."
#,DroneStrikeAct,드론공습법,Global terrorism threatens our country. Drone strikes on foreign grounds are a safe way to prevent terror organisations from reaching their full potential. Patriots are calling for surgical strikes on terror leaders while liberals regard those as unethical.
#,ElectricCarsInitiative,전기차 지원계획,The introduction of a standardized nation-wide recharging system for electric cars has lead to increased sales of such vehicles. Encouraging the acquisition of electric cars reduces our countries dependence on oil. Environmentalists are happy about every car that does not emit carbon dioxide.
#,ClimateChangeAdaptionFund,기후변화적응기금,"Global warming has lead to increased frequency and severity of natural disasters. The Climate Change Adaption Fund finances large-scale projects from dams to weather satellites, from reforesting to water reservoirs. It might be expensive, but environmentalists and farmers call for this policy."
#,OneChildPolicy,한 자녀 정책,A one-child policy is a measure of population control to keep overpopulation and related economic and social problems at bay. It reduces poverty and stabilizes the fertility rate. Parents and religious people oppose the law.
#,MarsProgram,화성 프로그램,"Tabloids have been speaking of a new space age for a while. It is time to reach for the stars! Why not start with the neighbor planet Mars? The Mars Program yields new technological innovations, unites the country, and makes patriots proud."
#,AntibioticsBan,항생제 사용금지,"Ranchers and farmers have been feeding antibiotics to livestock since they discovered decades ago that small doses of antibiotics administered daily make most animals gain additional weight. Although conclusive evidence directly linking the use of drugs in food animals to an increase in drug-resistant bacteria has not been uncovered, a number of recent studies suggesting such a link concern many scientists. Banning antibiotics leads to decreased meat production but ensures consumer safety."
#,MandatoryMicrochipImplant,마이크로칩 의무이식,"Passports can be forged and fingerprints can be faked. A microchip under the skin makes every individual in this country technically recognizable. Once implemented, law enforcement will be able to track exactly who went where when. Liberals are enraged about the possibility of absolute surveillance."
#,RareEarthRefinement,희토류 채굴,Support national initiatives for rare earth metal mining in order to make the country's industrial and high tech production less dependent on imports from foreign countries. The extraction process is not good for the environment but our technological advancement depends on rare earth metals. Environmentalists are furious.
#,DriverlessCarLaws,자율주행 법안,Driverless car technology is booming. The manufacturers are encouraging the government to allow their use on public roads.
#,SyntheticMeatResearchGrants,인공배양육 연구지원금,"Overfarming, droughts and population growth result in increases in meat prices. Synthetic production can make meat affordable for the masses. Farmers are opposed, as food production moves from the field to the lab."
#,InternetCurrencyTaxation,암호화폐 과세,"More and more commerce is handled in cryptocurrencies. To cover the cost of tax evasion and tie the new currencies to the fiscal system, rules and taxation are required. An internet currency tax reduces the income of everyone trading in cryptocurrencies, mostly self-employed and small companies."
#,VerticalFarmSubsidies,수직농업 보조금,Farmland is getting rare but recent inventions in architecture and agriculture could easily be bundled to make vertical farming in cities feasible. Food production in vertical farms requires more resources but reduced transport costs mitigate that problem.
#,GreenElectronicsInitiative,친환경 전자제품 정책계획,"The goal of the Green Electronics Initiative is to reduce electronic waste. From cleaner mining operations to upcycling projects, a broad array of measures should make the digital world a cleaner place."
#,InternationalFusionResearchProject,국제 핵융합 연구 프로젝트,"Participate in an international nuclear fusion research and engineering project with the goal of creating a commercially viable fusion power plant. Nuclear fusion is safer and more efficient than fission. While expensive, this research will contribute to technological development and energy efficiency. Environmentalists are traditionally wary of atomic energy."
#,LimitAutomatedTrading,자동매매 제한,"Automated stock market trading software exploits minute movements and short-term patterns in the markets, yielding to higher volatility and instability. Stock market crashes can be prevented by limiting the abilities of automated trading. Capitalists and the wealthy profit most from automated trading."
#,AutomationTax,자동화세,"Technological innovation has led to brilliant inventions. The dark side of industrial automation is that it is leading to job loss. Less jobs mean less income tax. To make up for the loss in state income, the economy ministry has designed an automation tax, to be paid by the most advanced companies."
#,GovernmentSubsidiesForUnions,노동조합 정부보조금,"Trade unions provide a vital service to our nation, and it is in the collective interests of the people that they be encouraged and supported throughout all industries and workplaces. Therefore the government should provide funding, from taxation to support their activities."
#,SecretCourts,비공개 재판,"To combat modern terrorism and crime, it is sometimes necessary to keep things from the public. For that, secret courts are established and controlled by government officials to assure that the law is followed and not broken. We cannot effectively fight terrorism and serious crime if our secret services methods get exposed in open courts."
#,GeneralMediaCensorship,일반매체검열,"There are times when an outraged public is counterproductive to the well-being of a democracy. Enabling  general media censorship can prevent bad rumors and speculation from spiraling out of control and while it limits civil rights, less violence and fear might be worth the effort. We do not wish to give antisocial extremists the free use of our media to create unrest."
#,TortureUsageBySecretServices,정보기관의 고문 허용,"Terrorists are tough customers and to prevent some attacks, extraordinary measures sometimes have to be deployed. While it is never 100% clear how much crime and terrorism can be reduced by such a policy, surely it makes sense to not fight such enemies with one hand tied behind the back of our security services? You have to fight fire with fire."
#,CapCEOPayMultiplier,최고경영자 임금상한제,"Nobody disputes that the job of CEO of a large company is hard, but the current level of pay for executives is out of control and is causing huge anger among the lower paid. A cap on CEO pay is entirely reasonable in a just and fair society."
