#,AdultEducationSubsidies,성인 교육 보조금,성인교육보조금은 근로자가 입사한 후에도 재교육과 교육을 지속할 수 있도록 유도하는 방법이다. 여기에는 야간 수업과 장거리 학습 자원이 포함된다. 이러한 계획은 노동력의 전반적인 교육 수준을 높이는 데 도움이 된다.
#,AgricultureSubsidies,농업 보조금,"전략적 이유로 일부 정부들은 국가의 안정적인 식량 공급을 보장하기 위해 농민들에게 보조금을 지불하는 것을 기쁘게 생각한다. 이것은 자유 시장을 역행하고 매우 비쌀 수 있지만 그것은 농업 사회의 일자리와 투표를 보호한다."
#,AirlineTax,항공연료세,항공 연료는 일반적으로 과세 대상이 아니다. 항공연료세를 지지하는 사람들은 이 세금이 환경파괴적인 운송에 대한 불공평헌 보조금이 된다고 주장한다. 항공사들은 항공 연료에 세금을 부과하는 것은 그들이 국외에서 연료를 급유하도록 부추겨 우리나라 경제에서 다른 곳으로 자금을 빼돌릴 뿐이라고 지적한다.
#,AlcoholLaw,주류법,"과도한 알코올 섭취는 건강상의 문제를 초래하고 심지어 사망까지 초래할 수 있다는 증거는 충분하다. 하지만 어떤 사람들은 국가가 개인의 권리에 간섭하는 것을 반대한다. 또한 정부가 술에 새금을 매겨서 많은 돈을 벌 수 있다는 문제도 있다."
#,AlcoholTax,주류세,"의학적으로 정부는 건강에 부정적인 영향과 사회 붕괴의 가능성 떄문에 소비를 억제하기 위하여 세금을 부과하는 분명한 사례가 있다. 반면에 술을 마시는 사람들은 정부가 그러한 세금으로 이익을 얻는 것은 위선적이라고 본다."
#,ArmedPolice,무장경찰,경찰을 무장시키는 것은 범죄를 저지하고 질서를 유지하는데 효과적인 전략이 될 수 있다. 반대론자들은 그것은 범죄자들이 '범죄 군비 경쟁'에서 총기를 사용하도록 장려한다고 주장할 것이다. 비판론자들은 또한 경찰을 무장시키는 것이 법을 준수하는 시민들이 경찰과 거리를 두게 될 것이라고 우려한다.
#,BanSundayShopping,일요일 쇼핑 금지,기독교는 일반적으로 '안식일'을 '휴식의 날'로 인식하고 있으며 많은 종교인들은 이 날 쇼핑을 해서는 안된다고 믿고 있다. 또한 일부 노동조합들은 휴식의 날을 통해 조합원들이 착취당하는 것을 막을 수 있다고 믿고 있다.
#,BiofuelSubsidies,바이오연료 보조금,"Biofuels can reduce oil demand, by mixing ethanol derived from corn with petro-chemical fuel. This is generally popular with environmentalists. Farmers who earn money producing corn for biofuel use also benefit. Biofuels with a higher mix of ethanol can be subsidized through tax breaks."
#,BorderControls,입국 심사,"Without some kind of customs checks at the borders, your country is open to the problem of mass illegal immigration. Some people argue that these immigrants cause crime, others that they take jobs away from your own citizens. Border controls can be effective in reducing illegal immigration."
#,BusLanes,버스전용차선,"Setting aside specific lanes of a road for use only by buses (and perhaps taxis and motorbikes) is one way to get traffic flowing faster and avoid congestion. It also shortens journey times for public transport and therefore encourages usage. There are noticeable costs involved in setting up such schemes, and motorists can be annoyed if the bus lanes seem empty while they remain stuck in traffic."
#,BusSubsidies,버스 보조금,"Traffic congestion and pollution can be reduced by encouraging people to travel by bus instead of car. It can be an expensive option though, and some motorists may resent a transport system they do not use being subsidized."
#,CarbonTax,탄소세,"A carbon tax is a tax levied on all emissions of Carbon Dioxide, thought to be the main cause of climate change. The tax is effectively a pollution tax, and a way to make those individuals and industries who contribute to climate change pay for the damage they cause or to reduce emissions. Obviously the tax is popular with environmentalists, and can also lead to a more energy efficient economy."
#,CarEmmissionsLimits,자동차 배출가스 제한,"Setting legal limits on exhaust fumes helps to reduce air pollution, especially in cities, but it's unpopular with motorists who look upon it as yet more bureaucracy and tax."
#,CarTax,자동차세,"Taxing the ownership of all motor vehicles is one way to persuade people to use alternative forms of transport. It can be argued however, that such a  system increases the fixed costs of car ownership, encouraging people to use a car more once they have gone to the trouble of taxing it. There is also an argument that this is a tax that unfairly hits the poor and people in rural communities where a car is a necessity."
#,CCTVCameras,CCTV 카메라,"CCTV cameras can be a great help in catching criminals and cameras also deter crime.  The installation costs are extremely high, and there are concerns about civil rights from people who don't like to feel that the government is constantly watching them."
#,ChildBenefit,아동수당,"A fixed payment made by the state directly to parents to assist in the cost of bringing up children. Popular with parents for obvious reasons, and the poor who see it as a redistributive tax, but capitalists are opposed to such an unnecessary level of interference by government."
#,ChildcareProvision,보육수당,"By giving state subsidies for childcare, we can ensure more parents return to the workforce after having children, and therefore benefit the economy. Although this can be expensive, and is also a distortion of the market, it is popular with parents."
#,CitizenshipTests,시민권 시험,"Citizenship tests are a way of ensuring that people migrating to our country have a demonstrable understanding of our culture and history. This lessens the chances of a clash of cultures for newcomers to the country, encourages integration and reassures patriotic members of society that they need not fear immigration."
#,CleanEnergySubsidies,친환경에너지 보조금,"Renewable energy might not be ultra efficient yet, but there is an argument for investing heavily in it now so as to strategically prepare our country for a future without fossil fuels. Environmentalists are happy for obvious reasons, but capitalists see it as an unwelcome distortion of the energy market."
#,CleanFuelSubsidy,친환경연료 보조금,"A Subsidy for cleaner fuels such as Ultra-Low Sulfur fuel in an effort to reduce the environmental impact of motoring. The subsidy will reduce the costs of fitting catalytic converters to older cars, and provide an incentive at the  pump to choose less damaging fuels."
#,CommunityPolicing,지역경찰제,"Working with the community rather than attempting to control it. Community policing encourages the police to better understand the needs of the local community, especially in areas with ethnic minorities. Critics see it as an expensive waste of money which could be spent on more direct methods to cut crime."
#,ConsumerRights,소비자 권리,"At a minimum level, the state guarantees that the consumer is not totally ripped off, at the other end of the spectrum, draconian legislation can benefit the consumer at the expense of business. Companies often complain about the amount of legislation governing selling to the public."
#,CorporationTax,법인세,"A direct and proportionate tax on the profits of business. Some argue that this should be the only form of taxation, others that such taxes stifle entrepreneurship and discourage people from starting a business. It is often one of the main ways the government brings in money."
#,Creationism,교육의 세속화,"A bitter battle has raged about the way children are taught science versus religion Scientists and Liberals consider it obvious that evidence based evolution should be taught in science classes. Some religious groups feel that it is wrong to teach evolution or 'Darwinism' as fact, when it remains an unproven theory or that creationism should be taught as an alternative theory in science. The government has to decide what is taught in our schools."
#,Curfews,야간통행금지,"Introduced  for a short period of time in  state of national emergency. These can be an effective way to combat crime at the cost of much personal liberty. Often, however, limiting the ability of peaceful citizens to leave their homes at night can be a sign of a country's degeneration into severe authoritarianism."
#,DeathPenalty,사형제,"The death penalty is the ultimate punishment for serious crimes. Opponents are concerned by the possibility of killing the wrong person, and suggest that only a barbaric state has the death penalty. Supporters point out that it absolutely guarantees no re-offending, and acts as a deterrent to serious crime."
#,DetentionWithoutTrial,재판 없는 구금,"Detention without trial allows your police and security services to detain suspects when they do not have sufficient evidence (or cannot reveal sensitive evidence) to convict suspects. This can be justified in the name of preventing terrorism, but Liberals are concerned that this infringes human-rights."
#,DisabilityBenefit,장애급여,"A direct payment from the state to disabled people to allow for the fact that they are possibly unable, or need assistance to work. Additionally many disabled people have special requirements in terms of transport or housing."
#,FaithSchoolSubsidies,종교학교 보조금,Religious schools can achieve good academic standards. Their supporters make a case  that the government should subsidize methods of education that are proven to be effective. Critics say that religion has no place in education and that the government cannot be seen to 'push' a particular religion on children.
#,ForeignAid,대외원조,"Some foreign countries have very poor economies, poor education or food shortages, and it can be argued that relatively rich nations such as ours have a moral duty to help them. Others may argue that the first priority of any nation is to its own citizens, and if those citizens wish to help, they can do so individually through charities."
#,FreeBusPasses,노년층 무임승차제,"Traditionally, free bus travel is offered as a concession to those citizens of retirement age. This can be expensive, but it's a great way to reduce car usage and thus reduce pollution and congestion. Some oppose such a distortion of the market however."
#,FreeEyeTests,무료 시력검사,"Eye tests catch problems early and advise those with poor eyesight that they need glasses. Getting your eyes tested privately can be expensive, and it's a luxury many people just do without. Socialists believe that the universal provision of free eye tests are essential in providing a health 'safety net' for all."
#,FreeSchoolMeals,무상급식,"Not only are free school meals a way of redistributing wealth by ensuring everyone can afford to feed their children, its also a way to ensure that children eat healthily rather than surviving purely on junk food."
#,Gambling,도박 합법화,"To some, gambling is a sin which leads to poverty and disaster, but others believe that some 'social' gambling is harmless fun which can also be taxed nicely by the government as an additional form of revenue. It also encourages tourism and creates jobs."
#,GatedCommunities,출입통제형 주거단지,"A drastic solution to serious street crime and vandalism, gated communities are basically self-policed residential areas. They are popular with the wealthy, but often associated with class divide and inequality, as only the relatively wealthy can afford to live inside them. As a result, some governments are reluctant to permit their construction."
#,GraduateTax,졸업세,"A graduate tax is a dedicated tax levied purely on people graduating from university, as a way of them contributing to the cost of their university tuition. Supporters say this is fair because not everyone benefits from a university education. Opponents argue that it creates a disincentive to study purely academic subjects and the arts, as well as penalizing ambition."
#,HandgunLaws,총기관리법,"Some countries allow the virtually unrestricted ownership of any kind of firearm, whereas in others it is strictly controlled. Some people talk of the basic right to defend yourself, others are concerned that gun ownership leads to gun crime."
#,HybridCarsInitiative,하이브리드 자동차 지원계획,"Hybrid cars are less damaging to the environment, because at slower speeds they use electric engines that produce no CO2. They also get higher fuel efficiency, thus reducing demand for oil. The downside is they are very expensive, but tax incentives can encourage more people to buy hybrid models when they get new cars."
#,IDCards,신분증,"Some say ID Cards act as a powerful deterrent against terrorism and other serious crimes, but liberals would argue that it is an infringement of an individual's civil liberties for the state to demand that citizens identify themselves on the spot."
#,ImportTarrifs,관세,"Cheap imports can be damaging to the economy because local companies cannot match the lower salaries paid by foreign competitors. Import tariffs help to protect local manufacturers from 'unfair' competition. This does go against real free-market economics though, and can be seen as being unfair to foreign countries, possibly sparking retaliation."
#,IncomeTax,소득세,"One of the most popular ways to raise money for government is a direct tax on peoples earnings, deducted at source by their employer. Income tax is generally a progressive tax (the wealthy pay more as a fraction of their income than the poor) and for this reason it is popular with socialists and the low paid."
#,FlatTax,정률세,"A flat-rate income tax is a tax where every citizen pays the same marginal rate of income tax regardless of their total income. As a result, the cleaner in the office pays the same rate as the CEO, though the CEO's total tax bill will be higher. This simpler structure can lead to lower avoidance and evasion. It is not progressive, and can exacerbate income inequality."
#,CapitalGainsTax,양도소득세,"CGT is a tax levied on non-salary income such as stock market profits and share dividends, and profits from selling property or other assets. Primarily it affects the wealthy and business owners, and will raise more money if the economy is booming. Because it taxes profits from investments, it also acts as a slight deterrent to investment and thus be detrimental to the economy."
#,InheritanceTax,상속세,"A tax paid on the wealth of an individual as it is passed on to their descendants. An inheritance tax protects equality, by preventing families amassing wealth and advantage over the generations, so it is popular with socialists and the poor. However, some people are strongly opposed to anything that prevents them handing on their hard-earned wealth, especially their house, to their children."
#,IntelligenceServices,정보기관,"Security services are an essential tool in the fight against organized crime and terrorism. Good, reliable intelligence can be difficult and expensive to obtain, and in many cases the methods employed can be unpopular with liberals and human rights advocates."
#,InternetCensorship,인터넷 검열,"Liberals would suggest that the internet's greatest characteristic is its freedom from censorship and control, leading to an open and tolerant society. Freedom has its price however, and there is no shortage of material on the internet that can assist those with criminal intent. Opinion on what should and should not be censored on the web is bitterly divided."
#,InternetTax,인터넷세,"As more and more commerce moves from conventional 'bricks and mortar' establishments to the web, governments are tempted to levy taxes on such transactions in order to 'level the playing field'. However, opponents of an internet tax claim that such a move would cripple the hi-tech economy and do enormous harm to the country's competitiveness."
#,JuryTrial,배심원 제도,"The right to be tried by ordinary members of the public rather than a judge is seen as a fundamental human right by many liberals. Conservatives argue that such a process is expensive, time wasting and is no fairer than a judge or a group of magistrates. Its entirely possible to have a system where a jury trial is reserved for more serious offences, with minor trials presided over by a magistrate."
#,LabourLaws,노동법,"Labor laws are basically restrictions on a worker's right to strike. Capitalists argue that such restrictions are vital to prevent key workers such as power station workers, policemen and train drivers from holding the country to ransom. Trade unionists consider the right to strike to be fundamental and not open to negotiation."
#,LegalAid,법률구조제도,"Not everyone has the money to pay a lawyer to defend themselves in court. Although a citizen could theoretically defend himself, providing state-employed lawyers should make for a fairer system. On the other hand, this is basically a big subsidy to people who have already been charged with a crime but remember they are innocent until proved guilty."
#,LegaliseProstitution,성매매 합법화,"Conservatives claim that the legalization of prostitution would mark a severe decline in family values. Others claim that as prostitution is unlikely to disappear, even if illegal, it's better for society and sex-workers that the practice is regulated and monitored rather than criminalized."
#,LuxuryGoodsTax,사치세,"A tax aimed specifically at the high spenders in our society. A surcharge is added to high value luxuries such as sports cars, private yachts etc. Although it is never a vast source of income, a luxury goods tax can be popular with those people concerned with the gap between rich and poor. A luxury goods tax could encourage high earners to live and work elsewhere."
#,MarriedTaxAllowance,기혼자 세액공제,"This is a tax break for married couples, given as an encouragement for people to marry and also to stick together. Church groups see it as essential that the state encourages traditional family values. Some see it as religion meddling in the tax system for no good reason."
#,MaternityLeave,출산휴가,"To some people, ensuring that mothers have a right to maternity leave and to return to their jobs afterwards is a sign of a civilized society, and one that encourages women to work. Some small businesses are concerned that it can put an unpredictable and even potentially crippling burden on an employer, especially where the number of employees is small. It could be argued that this actually encourages employers not to employ women."
#,MicrogenerationGrants,자가전력 보조금,"These grants are given to citizens to help subsidize the cost of energy micro-generation systems such as solar panels and wind turbines. This is a good way to take advantage of some people's desire to make a personal step towards cleaner and greener energy, and will increase the country's overall energy efficiency."
#,MilitarySpending,국방비,"A modern, well equipped military can cost an absolute fortune, and many people feel that the money could best be spent elsewhere. Others (especially patriots) would argue that you cannot put a price on freedom and security, and also point out the huge benefits for our businesses, technology and employment figures."
#,Monorail,고속철도 보조금,"This is not a standard rail network that drags along at mediocre speeds, but a modern high-tech rail system fit for the twenty first century, connecting the country and allowing super-fast travel between major cities. The costs are high, but the benefits for commuters, the economy and the environment are clear."
#,MortgageTaxRelief,주택담보대출 소득공제,"This allows people to claim tax relief on the interest payments they have to make when they borrow money to buy a house. This helps homebuyers to afford their mortgage payments, but can be resented by those who are not in a position to buy a house, as it is effectively a tax break for homebuyers."
#,Narcotics,마약 합법화,"Should drugs such as cannabis and heroin be legalized? Supporters suggest that it is the crime associated with the buying black-market drugs that cause problems, and legalizing narcotics would reduce crime. Opponents point to the health risks and say it would be giving into criminals."
#,NationalService,국민개병제,"Compulsory military service for some citizens where they are taught the basics of how to defend this country from attack has some benefits. For example it would allow us to have a smaller regular army. However, there are concerns about forcing people to bear arms against their will."
#,OrganDonation,장기 기증,"There are few who would disagree that organ transplant is an amazing technology but it requires a plentiful supply of donors. Sadly many people do not give the topic consideration. Some suggest that an 'opt-out' policy is best, with consent for donation assumed unless otherwise stated. Others suggest that this is no place for the state to interfere and explicit permission should be requested."
#,OrganicSubsidy,유기농농업 지원금,"Supporters of organic farming say the state should subsidize this method of farming because of the perceived health benefits of food without artificial flavorings and additives. Naturally this is popular with farmers and environmentalists, but some people see it as a pointless distortion of what should be a free market."
#,PetrolTax,유류세,"Taxing fuel can be a huge source of income for a government, and can also be seen as a 'green' policy by encouraging people to drive less, or to use more fuel efficient cars. Critics suggest that this is just another cynical tax on the motorist, and some complain that the alternative (public transport) is not a viable option for everyone."
#,PhoneTapping,도청,"From a law and order perspective, wire tapping is an essential weapon in the fight against organized crime and terrorism. The problem is that it's difficult to prevent misuse of such a system, and liberals are keen to point out how widespread wire tapping is a very sinister sign of a police state."
#,PlasticBagTax,비닐봉투세,"Plastic bags, unlike paper ones are not biodegradable so can last more or less forever, eventually ending up in huge unsightly landfill sites. A tax on bags discourages their use and encourages people to re-use stronger, more environmentally friendly alternatives. Capitalists just see this as the state meddling."
#,PoliceForce,경찰,"Every government needs to employ a police force to ensure order is kept and laws are obeyed, but it's a matter of debate exactly how much should be spent on the police. Some favor a large force with police on every street corner, other prefer a more low-key and tolerant approach."
#,PollutionControls,공해방지법,"Restrictions on what chemicals and emissions can be released into the atmosphere. Controls reduce pollution and increase health, possibly at the cost of economic competitiveness."
#,PrisonerTagging,전자발찌,"A high tech alternative to incarceration that allows people to re-integrate with the community upon release from prison, whilst allowing law enforcement authorities to keep a close eye on them. Liberals have concerns that such a system is a step towards a police state which monitors our every move."
#,Prisons,교도소,"Some argue that providing the minimum number of bare, cold cells is the only provision that needs to be made for those who have broken the law. Others suggest that spending more money allows for prisoners to be rehabilitated as well as punished and reduces the chances of reoffending."
#,PropertyTax,재산세,"Property tax is a tax levied on the value of homes. The valuation is often made by a government body, and the money is used to fund local government services (at least in part) such as the provision of street lighting and emergency services. Some see it as a fair tax which mostly affects those who own large homes and are wealthy, others see it as an unfair tax on retired people with large homes but little actual income."
#,PublicLibraries,공립 도서관,"Public libraries provide a number of services, acting as a focus for communities, providing access to information and literature to those on low incomes, and enabling people to learn new skills outside the normal educational establishment."
#,RacialProfiling,인종기반 수사기법,"Racial (or ethnic) profiling is the practice of using race as a factor in identifying criminals and potential criminals. Law enforcement officials claim that using racial profiling allows them to quickly narrow down lists of potential suspects, and to best concentrate their efforts but opponents fear that it leads to racial discrimination by the police."
#,RaceDiscriminationAct,인종차별금지법,"Prevents citizens being discriminated against purely on the basis of race, i.e. racist employment practices etc."
#,Recycling,재활용,"Supporters of recycling argue that dumping waste in landfills just isn't a long term solution, and the government needs to show the way by providing facilities to recycle as many waste materials as possible. This might include recycling newspapers, cardboard, bottles and even some plastics."
