#,PublicRightsOfWay,공공 통행권 확대,우리나라에 더 많은 주택을 지으면서 보행자와 등산객이 이용하던 개방된 땅이 점점 더 폐쇄되고 사유 재산으로 간주되고 있습니다. 사회주의 운동가들은 이러한 변화에 항의하고 법으로 보호된 '공중 통행권'의 확대를 요구하고 있습니다.
#,PublicRightsOfWay_0,아무 조치도 취하지 않음,"농지든 공업용지든 누군가의 정원, 마당이든 사유지는 사유지입니다! 사람들이 오랜 세월 동안 특정한 길을 걸어왔기 때문에 계속해서 사유재산에 대한 침해권을 가져야 한다는 생각은 터무니없습니다. 사람들이 이용할 수 있는 많은 공공 도로와 공원이 있습니다."
#,PublicRightsOfWay_1,통행권 확대,우리나라의 많은 부분이 이제 사유 재산이 되어 사람들이 탁 트인 시골에 접근하는 것이 우려스러울 정도로 제한됩니다. 소수 보행자와 등산객이 가끔 지정된 보도를 따라 토지를 가로질러 지나가는 게 농부에게 그렇게 해가 됩니까? 모든 사람이 개방된 시골과 보도에 쉽게 접근할 수 있도록 해야 합니다.
#,PUBLIC SMOKING BAN,공공장소 금연,흡연과 열악한 건강 사이에는 여러 의심되는 연관성이 있습니다. 압력 단체는 흡연자들에게 금연을 독려하기 위해 공공장소에서 모든 흡연을 금지할 것을 촉구했습니다.
#,PUBLIC SMOKING BAN_0,공공장소 흡연 금지,이것은 이 나라에서 흡연 관련 질병으로 사망하는 사람의 수를 줄이기 위한 중요한 진보입니다. 국민의 건강을 위해 이와 같은 법률을 통과시키는 것은 국가의 의무입니다.
#,PUBLIC SMOKING BAN_1,법을 바꾸지 않음,"사람들이 이렇게 살아라, 저렇게 살라 하는 것은 국가의 역할이 아닙니다. 이것은 완전한 과잉 대응이며 시민의 자유에 대한 공격입니다. 흡연은 합법이므로 공공장소에서 자유롭게 흡연해야 합니다. 사람들은 건강에 대해 스스로 결정할 자유가 있습니다."
#,ReasonableForceLaw,합리적 폭력 사용,"한 시골 남자가 자신의 집에 침입한 십 대 강도를 총으로 쏴 살해한 최근의 법원 사건에서, 집주인이 과실치사 혐의로 기소됨으로써 재산을 방어할 때 합당한 무력행사에 관한 법률적인 토론이 조명을 받고 있습니다."
#,ReasonableForceLaw_0,합리적 폭력의 정의를 협소화,"자신의 재산을 보호한다고 해도 다른 사람의 생명을 앗아갈 권리는 없습니다. 모든 경우에 인간의 생명이 재산보다 우선되어야 합니다. 도둑질을 동정하는 사람은 많지 않지만, 사람들이 폭력을 통해 자기 손으로 법을 집행하도록 놔두는 것은 확실히 해결책이 아닙니다."
#,ReasonableForceLaw_1,합리적 폭력의 정의를 확대,"경찰력이 닿기 힘든 곳에 사는 겁에 질린 한 남성이 자기 집에서 폭력적인 범죄자에게 공격을 받아 싸우는 와중에 범인이 죽었는데, 기소 여부를 떠나 애초에 체포당했다는 게 말이 안 됩니다. 무슨 일이 일어나든 모든 국민은 재산을 방어하기 무력을 사용할 권리가 있음을 명확히 해두어야 합니다."
#,ReasonableForceLaw_2,수단 불문의 자산 방어권,주택 소유자가 자신을 방어하기 위해 사용하는 모든 수단을 경찰이 눈 감아줄 것이라는 점을 분명히 해두어야 합니다. 어떤 강도가 다른 사람의 부엌에서 기관총 세례를 받는다 해도 그건 자업자득입니다.
#,ReligiousSymbols,학원 내 종교 상징물,학생들이 공립학교에서 종교적 상징물을 착용하는 것을 금지하는 법을 도입해야 한다는 압력이 있습니다. 여기에는 여성 무슬림 학생들의 히잡 착용과 기독교 학생들의 십자가 착용이 포함됩니다.
#,ReligiousSymbols_0,금지 조치 도입,"학교는 종교적 소속감을 표현하기 위한 곳이 아니라 아이들이 배우는 곳입니다. 모든 학생이 같은 옷을 입도록 함으로써 차별 없이 모든 종교의 평등과 통합을 보장할 수 있습니다. 이것은 정교 분리의 원칙에 부합합니다. 교회와 모스크에서는 자유롭게 옷을 입을 수 있지만, 공립 학교에서는 안 됩니다."
#,ReligiousSymbols_1,금지 조치 거부,이것은 무슬림에 대한 차별일 뿐입니다. 아무도 이 법이 기독교 십자가의 착용을 방지하기 위해 사용될 것이라고 기대하지 않습니다. 순전히 무슬림 학생들이 원하는 대로 옷을 입는 것을 금지하기 위한 변명일 뿐입니다. 이것은 분열과 분리를 야기할 것이며 학교 내 종교적 긴장을 조장할 것입니다.
#,RoyalScandal,왕실 스캔들,"왕실의 일원이 성범죄 전과자로서 오랫동안 세간의 추문에 휩싸여 온 인물과  의심스워리 만큼 자주 어울렸다는 비난을 받고 있습니다. 잘 봐줘서 '잘못된 판단'을 한 정도로 묘사되고 있지만, 과연 어디 정도까지 가담했는지 매우 의심스럽습니다. 정부가 어떻게 대응해야 할까요?"
#,RoyalScandal_0,왕실을 지지,"현 정부가 왕실을 공개적으로 비판할 것을 기대하는 사람은 없습니다. 그런 비판은 중대한 헌법상 '난제'로 이어질 가능성이 높으며, 매우 비애국적인 행위로 간주될 것입니다. 주장은 단순히 주장일 뿐이며, 특정인과 연루되었다는 이유만으로 죄인 취급을 할 수 없다는 성명을 발표해야 합니다."
#,RoyalScandal_1,왕실을 비판,"어떻게 아무런 논평 없이 이런 일을 묵과할 수 있습니까? 당신의 정부가 왕실 폐지를 요구할 것이라고는 아무도 기대하지 않지만, 왕실과 애국자들이 어떻게 생각하든 간에 적어도 그러한 행동은 '용납할 수 없다'는 취지의 강력한 표현이 적절할 것입니다."
#,RuleOutFirstStrike,선제공격 가능성 배제,"대량 살상 무기는 이론적으로 최후의 수단으로 사용할 수 있는 무기이며 순전히 억지력으로 작동합니다. 이를 염두에 두고, 그러한 무기를 먼저 사용하지 않을 것을 공개적으로 약속해야 한다는 압력이 있습니다."
#,RuleOutFirstStrike_0,선제공격 가능성 배제,"이것은 그러한 무기를 소유하려는 우리의 목적을 공개적으로 다시금 밝히는 것일 뿐입니다. 대량 살상 무기 프로그램을 확장하려는 계획은 없으니 그러한 무기가 순전히 외국의 침략을 억제하는 방어 수단으로 존재한다는 것은 자명합니다. 이것은 또한 다른 국가들이 같은 주장을 하도록 독려하는 방법이기도 하며, 국제적 긴장을 완화하고 더 안전한 세상으로 이어질 수 있습니다."
#,RuleOutFirstStrike_1,노코멘트,"우리 전략을 모두가 들여다볼 수 있도록 전 세계에 공개하는 건 우리 군의 손을 묶는 것과 마찬가지입니다. 우리의 잠재적인 적국이 그 같은 자화자찬식 발표를 하려 서두르지 않는 데는 다 그럴만한 이유가 있는 겁니다. 섣부른 선제공격이 촉발될 가능성을 배제하고 싶다면, 그쪽 먼저 발표하라고 하세요. 우리 쪽이 조급하다는 인상을 주지 맙시다."
#,SafeguardOilSupplies,석유 공급 보호,국내 석유회사 대표들은 중동에 있는 우리 정유 공장을 테러 공격에서 보호하기 위해 우리 군 병력을 배치해 줄 것을 정부에 요청했습니다. 상대국 정부는 우리 군대가 이러한 목적으로 그들의 영토에 주둔하는 것을 쾌히 승낙합니다.
#,SafeguardOilSupplies_0,병력 파견,"이것이 우리가 군대를 보유하는 이유이며, 군사력을 사용하는 것을 두려워해서는 안 됩니다. 우리가 석유 공급을 보호하기 위해 단호한 조치를 취할 준비가 되어 있다는 것을 외국 테러리스트들이 알아야 합니다. 이것은 '외국 침략'이 아니라 해외에서 발생하는 우리 산업의 중요한 부분에 대한 추가적인 보안 제공일 뿐입니다. 우리가 군대를 배치하지 않으면 석유 공급이 분명히 곤란해질 것입니다."
#,SafeguardOilSupplies_1,병력 배치 안 함,동기가 무엇이든 중무장하고 치명적인 무력을 사용할 채비를 갖춘 우리 군대가 외국 땅에 상륙하는 것이 상징하는 바는 일부 국가에서 큰 반발을 일으킬 것입니다. 이것은 국제 관계의 문제와 테러 증가의 가능성으로 이어질 수 있습니다. 우리 군인들은 석유 회사의 보안 요원이 아니며 이것은 그들이 할 일이 아닙니다.
#,SchoolSponsorship,기업의 학교 후원,많은 대기업이 우리 공교육 시스템에 대한 투자에 관심을 표명했습니다. 무료 교과서에서 시설이 완비된 스포츠 센터에 이르기까지 모든 것을 일부 브랜드 홍보와 판촉 기회에 대한 대가로 제공하겠다고 합니다.
#,SchoolSponsorship_0,후원 허용,무료 교육 자료 제공을 거절하는 것은 미친 짓입니다. 정부는 이 회사들이 우리 학교들에 주려고 하는 최첨단 시설을 제공할 여력이 없습니다. 교육에 대한 막대한 투자의 대가로 학교 교재에 회사 로고를 좀 붙이는 것을 문제 삼을 이유가 없습니다.
#,SchoolSponsorship_1,후원 방지,"우리 학교는 아이들이 교육을 받는 곳이지, 특정 브랜드의 콜라를 사 마시도록 세뇌시키는 곳이 아닙니다. 광고는 사회 곳곳에 존재하며 학교는 우리가 광고를 피할 수 있는 마지막 장소 중 하나입니다. 교육에서 대기업을 배재하십시오!"
#,SharedParentalLeave,육아휴직 공유,"전통적으로 유급 육아휴직은 어머니만을 위한 것이었으나, 부모의 형편에 따라 시간을 부부가 나눠 쓸 수 있도록 하자는 제안이 있습니다. 이것은 성 평등을 향한 한 걸음으로 여겨집니다."
#,SharedParentalLeave_0,엄마 전용으로 유지,"전혀 필요하지 않은 조치입니다. 이는 육아휴직 제공을 복잡하게 할 뿐이며, 대다수 부모는 출산을 위해 엄마가 휴가를 내는 것이 가정에 가장 유리하다는 데 동의합니다. 이것은 남녀 성별 사이에 아무 차이가 없는 척하는 정치 아젠다에 집착하는 것일 뿐입니다."
#,SharedParentalLeave_1,육아휴직 공유 허용,"요즘 세태에서 출산 후 부모가 유급휴가를 요청하는 건 국가에서 정할 일이 아니라 부모의 몫으로 남겨두는 게 당연합니다. 우리는 더 이상 모든 육아를 어머니가 하는 세상에 살고 있지 않으며, 현재 시스템은 단순히 구식 관점의 성차별적 유산일 뿐입니다."
#,SingleUsePlasticBan,일회용 플라스틱 금지,"우리의 수자원, 바다, 심지어 우리가 숨 쉬는 공기를 오염시키는 플라스틱의 충격적인 양이 연구된 후 과학자들은 플라스틱 오염 문제를 통제하기 위해 일회용 플라스틱을 완전히 금지해야 한다고 말합니다."
#,SingleUsePlasticBan_0,일회용 플라스틱 금지,"단 한 번 사용되어 분해되는 데 수백 년이 걸리고 심지어 수자원에 유입될 수도 있는 플라스틱 포장재를 기업들이 사용하도록 놔둔다는 것은 정말 말도 안 되는 일입니다. 사용할 수 있는 다른 재료들이 있으며, 기업이 올바른 일을 하고 보다 지속 가능한 제품으로 교체하도록 설득하는 길은 정부의 입법뿐입니다."
#,SingleUsePlasticBan_1,일회용 플라스틱 허용,"이것은 군중이 환호할만할 쉬운 변화처럼 들리지만, 업계에 미치는 영향은 엄청날 것입니다. 좋든 싫든 우리는 삶의 많은 부분에서 값싼 일회용 플라스틱이라는 생각에 익숙해졌습니다. 금지는 우리 중소기업에 막대한 비용과 규제 지옥을 초래할 것이며 경제적 악몽이 될 것입니다. 한편 우리 업체와 경쟁하는 외국 회사는 일회용 플라스틱을 거리낌 없이 사용할 것입니다."
#,SpeedLimits,속도 제한,주요 자동차 운전자의 압력 단체가 정부에 우리 주요 도로의 제한 속도를 올리도록 로비했습니다. 이 속도 제한은 수년 전에 설정되었으며 그 이후로 자동차 속도와 제동 성능이 모두 향상되었습니다.
#,SpeedLimits_0,속도 제한 증속,사람들이 자동차 앞에서 붉은 깃발을 들고 걷던 때부터 세상은 많이 발전했습니다. 전국의 속도 제한은 어리석게 낮고 제한 무시가 팽배합니다. 우리는 속도 제한을 효과적으로 집행할 수 없으며 속도 제한을 합리적인 선으로 조정하지 않으면 사람들이 법을 어기도록 부추길 뿐입니다. 즉시 한도를 높여야 합니다.
#,SpeedLimits_1,변경 없음,"속도 제한에는 그만한 이유가 있습니다. 안 그래도 우리 도로에서 많은 사람이 죽고, 속도는 종종 자동차 사고의 생존 가능성에 영향을 미치는 요소입니다. 사람들이 수시로 제한을 무시하는 건 사실이지만, 지금 제한 속도를 높이는 것은 더 빠르고 위험한 운전을 부추길 뿐입니다. 그대로 두십시오."
#,SQUATTERS RIGHTS,무단거주자 권리,"수도에서 가장 좋은 동네 중 하나에 있는 빈 저택이 노숙자들에게 점령당했습니다. 그 집은 수년 동안 사용되지 않고 비어 있었고, 변호사들은 이제 '무단 거주자'들이 해당 주거지를 계속 점유할 권리가 있는지를 놓고 논쟁을 벌이고 있습니다. 집주인은 이들의 퇴거를 원합니다."
#,SQUATTERS RIGHTS_0,무단거주자에게 주택 양도,"사람들이 너무 부유해서 여러 채의 집을 소유하고 그 중 몇 채를 비워 둘 수 있는 반면에, 살 곳이 없는 일부 시민이 있다면 이들이 그 집을 잘 사용하는 것이 옳고 공정합니다. 집주인은 분명히 수년 동안 그 집이 필요하지 않았으니 이제 법적으로 점유자에게 양도되어야 합니다."
#,SQUATTERS RIGHTS_1,무단거주자 퇴거,누군가의 재산을 도둑에게 건네주는 것과 마찬가지인 위험한 선례입니다. 소유자가 돈이 많아 부동산을 비워 놓고 있다고 해도 그건 그 사람의 마음입니다. 이 무단 거주자들이 집주인처럼 저축하고 합법적으로 집을 사지 못하게 막은 사람은 아무도 없습니다. 경찰을 보내 이 사람들을 쫓아내십시오.
#,STOP AND SEARCH POLICE POWERS,불심검문,경찰이 범죄를 저질렀다고 의심되는 사람을 거리에서 불심검문할 수 있는 권한을 요구하고 있습니다. 현재 우리 경찰은 공식적으로 체포하지 않고는 누군가를 수색할 수 없습니다.
#,STOP AND SEARCH POLICE POWERS_0,권한 도입,범죄와의 전쟁에서 귀중한 무기가 될 것이며 특히 폭력과 거리 범죄에 눈에 띄는 영향을 미칠 것입니다. 우리 시민들은 죄지은 것이 없다면 이 법을 두려워할 이유가 없습니다.
#,STOP AND SEARCH POLICE POWERS_1,현행 유지,"매우 위험한 조치입니다. 인종적 근거로 남용될 소지가 매우 높으며, 경찰과 지역사회의 관계를 악화시킬 것입니다. 우리 시민들은 당국의 간섭 없이 합법적인 일상을 자유롭게 영위해야 합니다!"
#,Streamer,스트리머의 생일 축하 노래 제안,인기 있는 인터넷 스트리머가 공개적으로 당신의 생일에 축하곡을 불러주겠다고 제안합니다. 그녀는 아슬아슬한 의상과 성인 테마의 노래로 유명하여 젊은 사람들에게 매우 인기가 있습니다.
#,Streamer_0,제안을 수용,이것은 큰 영광이며 전국의 젊은이들에게 인기를 얻는 데 도움이 될 것입니다. 날씨가 추워서 평소보다 덜 노출되는 옷을 입기를 바랍시다.
#,Streamer_1,제안을 거절,"그녀가 유명하고 성공한 사람일지 모르지만, 분명히 우리 청소년들의 롤 모델은 아닙니다. 생일 축하 행사를 작고 품위 있게 유지하고 중요한 정치적 사인에 집중합시다."
#,StricterDrivingTests,더 엄격한 주행 시험,초보 운전자가 도로 조건에 훨씬 더 잘 대처할 수 있도록 하고 운전자 안전을 개선하고자 운전면허 시험 제도를 강화해야 한다는 요구가 있습니다.
#,StricterDrivingTests_0,시험을 강화,"현재의 주행 시험은 자동차 최고 시속 30km로 달리고 6차선 고속도로가 존재하기 전에는 괜찮았을지 모르지만, 시대가 바뀌었습니다. 운전자는 휴대전화로 인해 주의가 산만해졌고 운전 경험이 많지 않아도 모든 기상 조건에서 엄청나게 빠른 차량을 운전할 수 있습니다. 매년 많은 아이들이 차이 치여 사망하기 때문에 면허 시험을 더 어렵게 만들어야 할 필요가 있습니다."
#,StricterDrivingTests_1,변경 없음,"변경할 필요가 없습니다. 충돌 감지, 충돌 안전 시스템과 같은 현대 기술 덕분에 자동차는 매년 더 안전해지고 있습니다. 운전면허 시험은 이미 상당한 비용이 들며 운전 시험을 통과하는 데  많은 시간이 소요됩니다. 운전면허를 처음 따는 젊은 운전자들에게 부담이 될 것입니다."
#,SupportDemocracyProtesters,민주주의 시위대 지지,"우리와 역사적 인연이 있는 외국에서 거리 시위가 벌어지고 있습니다. 우리는 이 나라와 큰 수익을 내는 무역을 하지만, 그 정부는 권위주의적이며 우리는 거리 시위대의 대의를 공개적으로 지지해야 한다는 압력에 직면해 있습니다."
#,SupportDemocracyProtesters_0,시위대 지지,"우리는 민주주의를 믿습니까, 믿지 않습니까? 복잡하게 생각할 일이 아닙니다. 정부가 권위주의적인 경향을 보이고 있고 시위대의 주장이 일리 있다고 믿는다면 우리는 원칙대로 이를 지지해야지, 무역 거래에서 돈을 벌겠다고 모른 척하고 침묵을 지켜선 안 됩니다."
#,SupportDemocracyProtesters_1,노코멘트,입장을 바꿔 우리 정부가 거리에서 시위대를 마주하고(모든 민주주의 국가가 그렇듯이) 외국 지도자들이 그런 반정부 시위대를 공개적으로 지지한다면 기분이 어떻겠습니까? 상대적으로 소수에 지나지 않는 거리 시위대의 편을 든다면 무역 상대국과의 외교 관계에 악영향을 미칠 겁니다.
#,SurgicalStrikes!,정밀 타격!,중동의 테러리스트들이 국내 기업이 소유하고 우리가 간접적으로 연료를 공급받는 중요한 파이프라인을 공격하기 시작했습니다. 석유 공급을 보호하기 위해 우리 군은 신중하게 선택한 적 목표물에 대한 정밀 타격을 시작하려고 합니다.
#,SurgicalStrikes!_0,정밀 타격 명령,테러는 실질적인 위협이며 유가 상승은 성장에 장애가 됩니다. 우리는 우리 군인들의 생명을 위험에 놓이게 하지 않으면서 테러 작전을 방해할 수단을 가지고 있습니다. 지금 공격해 테러리스트들이 우위를 점하는 것을 막아야 합니다.
#,SurgicalStrikes!_1,응전하지 말 것,"그 지역의 문제는 경제적, 사회적 이유로 말미암은 것이며 테러리스트 지도자를 폭격하는 것만으로 해결할 수 없습니다. 지상전과 이에 따른 국가 재건은 비용이 더 많이 들지만 훨씬 더 효과적으로 이 지역의 문제를 해결할 방법입니다."
#,TestBanTreaty,핵실험 금지 조약,"유엔은 연구 목적의 핵무기 실험을 금지하는 조약에 서명할 것을 당신의 나라에 촉구하고 있습니다. 다른 많은 국가가 이미 조약에 서명했으며, 우리도 이에 서명하도록 외교 채널을 통해  압력을 가하고 있습니다."
#,TestBanTreaty_0,조약에 서명,"유엔은 연구 목적의 핵무기 실험을 금지하는 조약에 서명할 것을 당신의 나라에 촉구하고 있습니다. 다른 많은 국가가 이미 조약에 서명했으며, 우리도 이에 서명하도록 외교 채널을 통해  압력을 가하고 있습니다."
#,TestBanTreaty_1,조약에 서명 안 함,제한된 실험을 수행할 권리를 유지하는 것이 중요합니다. 우리는 위험한 세상에 살고 있으며 핵 억지력은 우리의 방어에 필수적입니다. 우리나라를 방어하는 일에 다른 나라들이 이래라저래라 할 수 없습니다. 게다가 기존 무기를 계속 사용할 수 있는지 확인하려면 실험해야 합니다.
#,TortureDeportation,추방자 고문,"우리나라에 불법체류 중인 사기꾼을 경찰이 검거했습니다. 정상적인 상황에서는 그를 본국으로 추방할 수 있지만, 이 자는 고국으로 돌아가게 된다면 자국 정부에 의해 고문을 당할 것이라고 주장합니다."
#,TortureDeportation_0,추방함,이 상황에 이른 것은 자신의 잘못입니다. 그는 이 나라에 불법으로 입국했고 이곳에 온 이후로 범죄 활동을 했습니다. 도착했을 때 정치적 망명을 신청하고 범죄 활동을 시작하지 않았다면 문제가 다를 것입니다. 이러한 상황에서 고문 위협에 대한 그의 주장을 곧이곧대로 받아들일 수 없습니다.
#,TortureDeportation_1,국내 수감,"이 사람이 모범 시민이 아닌 것은 분명하지만, 어떤 사기꾼이라 해도 고문을 받아서는 안 됩니다. 고문 사용 반대가 진정 우리의 원칙이라면 이 남자의 과거 행동에도 불구하고 고국으로 돌려보냄으로써 고문당하게 둬서는 안 됩니다. 우리가 그를 추방하면 사실상 사형 선고가 될 수 있습니다."
#,ToxicWasteDump,유독성 폐기물 처리장,"우리나라에 대규모 유독성 폐기물 처리장을 건설하자는 제안이 제출되었습니다. 이 시설은 매우 큰 규모라 건설에 잠재적으로 많은 일자리를 창출할 것이지만, 환경에 미칠 영향에 대한 우려가 있습니다."
#,ToxicWasteDump_0,폐기물 처리장 허용,"자신의 뒷마당에 유독성 폐기물을 원하는 사람은 없지만, 잠재적인 일자리는 말할 것도 없고 이 시설을 설치함으로써 얻을 수 있는 경제적 이익에 등을 돌리는 건 어리석은 짓입니다. 폐기장을 일자리를 원하고 리스크가 낮은 시골에 건설할 수 있습니다."
#,ToxicWasteDump_1,폐기물 처리장 방지,일자리가 얼마나 많이 생기고 돈이 얼마나 벌리던 우리는 우리나라를 다른 나라의 쓰레기 구덩이로 임대해서는 안 됩니다. 이 유독성 폐기물의 영향은 여러 세대에 걸쳐 지속될 수 있습니다. 이것이 정말로 우리가 우리 아이들에게 남기고 싶은 유산입니까?
#,TradeAgreement,무역 협정,"여러 서방 국가가 관세, 쿼터, 기타 무역 제한을 규제하는 새로운 무역 협정을 맺기 위한 이니셔티브를 수립했습니다. 이 계약은 글로벌 공정성을 해치지만, 신흥 국가가 서방 국가의 경제를 따라잡고 지배적인 위치에 오르는 것을 방지하는 데 도움이 될 것입니다."
#,TradeAgreement_0,협정에 서명,우리 경제는 세계 시장의 새로운 참가 국가들로부터 스트레스를 받고 있습니다. 우리는 이 새로운 적대적인 경제 환경에서 승리하기 위해 오랜 친구들과 더 긴밀한 유대를 맺어야 합니다.
#,TradeAgreement_1,협정 서명 거부,"이 협정은 우리 경제에는  보탬이 되지만, 글로벌 공정성을 해칠 것입니다. 우리 자신만 생각할 때가 아니라 세계 시장의 새로운 플레이어들을 두 팔 벌려 환영해야 할 때입니다."
#,TransgenderMilitaryBan,트랜스젠더 입대 금지,사상 최초로 트랜스젠더가 군인으로 복무하게 되었습니다. 안타깝게도 이 병사들은 트랜스젠더가 군대에 복무하는 것을 승인하거나 금지할 것을 요구하는 캠페인 단체 간 치열한 문화 전쟁의 중심이 되었습니다.
#,TransgenderMilitaryBan_0,트랜스젠더 병사 입대 금지,"이것이 군의 능력이나 안전에 영향을 끼칠지 모른다는 우려가 조금이라도 있다면, 그 점을 최우선으로 고려해야 합니다. 군은 값싼 정치 점수를 따기 위한 경기장이 아닙니다. 애국심 있는 트랜스젠더 병사가 군에서 복무할 수는 있지만, 최전선 전투 역할은 수행할 수 없습니다."
#,TransgenderMilitaryBan_1,트렌스젠더 병사 지지,"군인에게 정말 중요한 것은 전문성, 충성심, 애국심입니다. 트랜스젠더라서 군인이 되지 못한다는 생각은 터무니없습니다. 우리는 성별에 관계없이 모든 군인을 공개적으로 인정하고 지지해야 합니다."
#,TRAVELLERS RIGHTS,여행자 권리,"한 지역 의회가 최근에 오래된 버려진 주택 일부를 철거했고, 빈 부지에 여행자들이 몰려와 캠핑카를 주차하고 있습니다. 화가 난 지역 주민들은 캠핑카들을  내쫓기  원하지만, 의회는 이 사람들이 어떤 권리를 가지고 있는지 확신하지 못해 정부가 명확히 선을 그어주기를 바랍니다."
