token,name,title,text
,,,
***Misc,,,
#,Welcome,환영합니다!,"데모크라시 4에 오신 것을 환영합니다! 이제 막 <PRESIDENT>으로서 첫 임기를 시작하셨고, 저는 비서실장으로서 업무가 어떻게 돌아가는지 설명해 드리려고 합니다. 아래 아이콘은 우리나라의 상태를 보여주는 몇 가지 주요 지표입니다. 상황을 개선하고, 임기를 마치신 후 재선에 성공하시기를 바랍니다! 아래 창의 버튼(""임기 시작"" 표시)을 눌러 관리를 시작하십시오..."
#,MainScreen,메인 화면,"여기에서 우리나라의 현황을 살펴볼 수 있습니다. 복잡해 보일 수 있지만, 모든 다른 구성 요소들도 매우 유사한 방식으로 작동합니다. 아이콘은 정책, 법률, 유권자 그룹, 국민 보건 및 교육 수준과 등 중요한 개념에 대한 값을 포함한 경제나 사회의 다양한 객체를 나타냅니다. 다음 버튼을 클릭하세요."
#,VoterStrips,유권자,"화면 왼쪽에 있는 이 줄은 유권자 그룹을 나타내며 색칠된 진행 현황 표시줄은 유권자가 정부에 얼마나 만족하는지 보여줍니다. 텍스트 뒤의 옅은 색 부분은 이러한 각 그룹에 속한 우리 유권자의 비율을 나타냅니다. 데모크라시 4의 핵심 개념 중 하나로, 유권자 개개인은 여러 다른 유권자 그룹에 동시에 속할 수 있으며, 이러한 그룹에 동조하는 정도도 개인마다 다릅니다. 상반되는 그룹들이 있기에 이러한 유권자 그룹 *모두*가 당신을 지지하게 되는 일은 없습니다!"
#,PolicyIcons,정책,"흰색 아이콘은 정책입니다. 몇몇 정책이 이미 구현된 상태에서 게임이 시작되지만, 대부분은 취소할 수 있고 더 많은 정책을 추가할 수 있습니다. 또한, 정책을 조정할 수도 있습니다. 정책은 당신이 국가를 통치하는 데 사용하는 기본 수단입니다."
#,SimIcons,데이터,"파란색 아이콘은 해당 국가와 관련된 통계 데이터를 나타냅니다. GDP(국내총생산 - 경제력), 범죄 또는 국민의 교육 수준과 같은 추상적인 개념과 관련이 있습니다. 당신은 정책 결정을 통해 통계 데이터에 간접적으로만 영향을 줄 수 있습니다. 다른 아이콘과 마찬가지로 해당 아이콘이 나타내는 경제/사회 부분(교통, 세금 등...)에 따라 화면의 다른 '영역'에서 찾을 수 있습니다."
#,SitIcons,상황,빨강 또는 초록 배경의 아이콘은 상황입니다. 이는 좋거나(초록)  나쁠(빨강) 수 있는 당신의 국가에서 진행 중인 사건들입니다. 정책 선택에 따라 좋은 상황을 장려하고 나쁜 상황을 예방하거나 수정할 수 있습니다.
#,Connections,연관성,"정책, 데이터 및 상황은 '효과'를 통해 상호 연결됩니다. 아이콘 하나 위에 마우스를 가져가면 긍정적인 효과는 초록으로, 부정적인 효과는 빨강으로 표시되어 영향력이 아이콘 사이에 어떻게 흐르는지 보여줍니다. 흐름의 속도는 효과의 강도를 보여줍니다. 이를 시험해 보시고 '다음'을 누르십시오."
#,VoterType,유권자!,특정 유권자 그룹을 살펴보고 이에 대해 자세히 알아보겠습니다. '중위소득' 유권자에 관한 유권자 정보줄을 클릭하십시오.
#,VoterType2,유권자 유형,"이 창에는 특정 유권자 그룹에 대한 자세한 정보가 표시됩니다. 각 유권자 그룹은 고유한 의견과 우선순위를 지니며 모든 사건이나 정책은 각 그룹에 다르게 영향을 미칩니다. 차트는 현재 시간 경과에 따른 유권자의 의견을 표시하지만, 시간 경과에 따른 소득 또는 그룹 구성원을 표시하도록 선택할 수도 있습니다."
#,VoterType3,입력,"이 영역은 이 유권자 그룹에 대한 다양한 '입력'의 목록과 이것들이 그룹 구성원들에게 어떤 느낌을 갖게 하는지를 보여줍니다. 초록 효과는 좋고 긍정적이고 빨강 효과는 나쁘고 부정적입니다. 이러한 효과는 정책, 상황, 값이 변경됨에 따라 시간이 지남에 따라 변경될 수 있습니다. 이 모든 효과의 합은 그룹의 느낌을 결정하는 데 사용됩니다."
#,VoterType4,드릴다운,개별 효과를 바로 가기로 삼아 클릭하면 해당 항목에 대한 자세한 정보를 볼 수 있습니다. 예를 들어 소득세가 중산층 유권자에게 미치는 영향을 보여주는 효과를 클릭해 보십시오.
#,IncomeTax1,소득세,소득세 세부정보 화면이 뜹니다! 두 항목 사이의 거의 모든 효과에 대해 이렇게 할 수 있습니다. 소득세는 정책(흰색 아이콘)이며 이 화면은 정책이 미치는 영향을 보여줍니다.
#,PolicySlider,정책 슬라이더,"이 슬라이더는 이 특정 정책을 제어하는 데 사용됩니다. 슬라이더를 사용해 소득세를 위아래로 조정할 수 있으며, 이렇게 하면 유권자 그룹, 상황, 통계 데이터 등 연관된 모든 항목에 미치는 영향이 바뀝니다. 슬라이더를 시험 삼아 조정해보고 '다음'을 누르십시오."
#,PolicySlider2,정책 슬라이더,슬라이더를 움직일 때 효과에 두 가지 다른 값이 표시되는 것을 눈치채셨을 것입니다. 현재의 (어두운) 효과와 슬라이더가 새 위치에 놓일 때의 효과입니다. 값은 각 효과의 맨 오른쪽에 있는 관성 시간(턴 수)에 기반해 시간이 지남에 따라 원래 위치에서 새 위치로 이동합니다. 해당 값이 0이면 효과는 다음 턴이 시작될 때까지 새로운 수치에 다다릅니다.
#,RevertChanges,변경 사항 되돌리기,"일단은 그대로 놔둡시다. 슬라이더를 조정했지만, 이 정책을 원래대로 두려면 '변경 사항 되돌리기' 버튼을 누르십시오."
#,QuitPolicy,정책 화면 나가기,"잘하셨습니다, 소득세는 충분히 봤으니 우측 상단의 닫기 버튼을 누르고 메인 화면으로 돌아가 보겠습니다."
#,Situations,상황,현재 우리나라에 영향을 미치는 상황 중 하나를 확인할 시간입니다. 자세한 정보를 보기 원하는 상황 아이콘을 클릭하십시오.
#,Situations2,상황,선택한 상황에 관한 정보를 보여줍니다. 보시다시피 상황에는 원인(왼쪽)과 결과가 있습니다. 여기서는 아무것도 변경할 수 없으며 그저 다양한 효과를 볼 수 있을 뿐입니다. 원인의 강도를 충분히 줄이면 상황을 종료시킬 수 있습니다.
#,Situations3,트리거와 그래프,이 화면 상단의 차트는 시간 경과에 따른 이 상황의 실제 강도와 두 가지 트리거에 관한 정보를 보여줍니다. 위쪽 트리거는 실제로 이 상황을 촉발시키는 값입니다. 아래쪽 트리거는 상황을 비활성화하는 값입니다. 결과적으로 상황을 촉발시키는 것이 상황을 끝내기보다 더 쉽습니다.
#,Situations4,상황,이제 이 상황을 끝내고 다른 데이터를 살펴보겠습니다. 닫기 버튼을 누르십시오.
#,Simvalue,통계,마지막 아이콘 유형인 통계 데이터를 살펴보겠습니다. 파란색 아이콘 중 하나를 클릭합니다.
#,Simvalue2,통계,이 화면은 국가 통계에 관한 정보를 보여줍니다. 상황과 마찬가지로 원인과 결과가 있습니다. 일부 통계값은 우리가 높이고 싶어하는 좋은 것(예: 보건)이고 다른 통계 값은 낮추고 싶은 나쁜 것(예: 범죄)입니다.
#,Simvalue3,통계,여기서 변경할 수 있는 것은 없으므로 닫기 버튼을 누르고 다시 메인 화면으로 돌아갑시다.
#,PoliticalCapital,정치 자본,"중앙 아이콘에서 이 값에 주의하십시오. 이것은 '정치 자본'으로, 정부가 일을 수행하기 위해 필요한 지지의 양을 나타냅니다. 턴당 제한된 양의 정치적 자본이 있습니다(각 턴은 1년의 4분의 1). 자본이 다 떨어지고 나서 더 많은 자본을 얻으려면 턴을 종료해야 합니다. 일부 정치 자본은 다음 턴으로 이월될 수 있지만, 전부는 아닙니다. 자세한 내용은 아이콘을 클릭하세요."
#,PoliticalCapital2,정치 자본,"정책을 조정하거나 취소하거나 새로운 정책을 구현할 때 정치 자본이 사용됩니다. 정책마다 요구되는 금액은 해당 정책이 논란인 정도에 따라 다릅니다. 자본은 장관들, 당신의 인기, 그리고 당신이 이전 선거에서 얼마나 극적으로 이겼는지 따라 생성됩니다."
#,PoliticalCapital3,정치 자본,메인 화면으로 돌아갑시다. 일단은 정치 자본 창을 닫으십시오.
#,NewPolicy1,새 정책,이제 새 정책을 만드는 방법을 살펴보겠습니다. 새 정책 버튼을 클릭합니다.
#,NewPolicy2,새 정책,이는 당신이 선택할 수 있도록 고문이 준비해 놓은 새 정책들입니다. 정책은 왼쪽에 탭에서 볼 수 있는 범주들로 나뉩니다. 선택한 정책의 세부 정보는 오른쪽에 있습니다. 빨간색으로 표시된 것은 현재 정치적 자본이 부족하여 구현할 수 없는 정책입니다. 정책을 선택한 다음 구현 버튼을 누르십시오.
#,NewPolicy3,새 정책,이것은 구현하기로 선택한 새 정책입니다. 새 정책에 대해 슬라이더를 무료로 조정할 수 있습니다(정치 자본을 소비하지 않음). 일부 정책은 구현하는 데 시간이 걸리므로 완전히 작용하려면 시간이 걸립니다. 일단 메인 화면으로 돌아갑시다. 오른쪽 상단의 닫기 버튼을 눌러주세요.
#,NextTurn,다음 턴,"볼 것이 훨씬 더 많지만, 나중에 다루도록 하겠습니다. 할 수 있는 일들, 하고 싶은 일들을 마쳤으면 턴을 마칩니다. 화면 오른쪽 상단의 턴 종료 버튼을 누릅니다."
,,,
#,Report,보고서,"분기별 보고서입니다. 이것은 국가의 현재 상태에 영향을 미치는 몇 가지 주요 지표를 조명합니다. 또한, 알아두어야 할 다른 정보가 있을 수도 있습니다. 이번 분기에 주의가 필요한 긴급한 딜레마가 표시될 수도 있습니다. 어쨌든...살피셔야 할 일이 많은 것 같으니 업무를 시작하십시오. 믿음직스럽게 정부를 운영하시리라고 확신합니다."
,,,
#,Expenses,지출,이 차트는 정부 지출 내역을 보여줍니다. 개별 항목을 클릭하면 자세한 내용을 볼 수 있습니다. 여러 항목의 비용은 다양한 요인에 따라 시간이 지남에 따라 달라집니다.
,,,
#,Income,수입,"이 차트는 정부 수입 또는 수익의 분석을 보여줍니다. 수입이 지출보다 적으면 부족분이나 적자는 정부 차입으로 메워질 것입니다. 단기적으로는 괜찮을지 모르지만, 차입은 국가의 부채를 증가시키고 모든 부채에는 이자가 발생합니다. 항목을 클릭하면 자세한 내용을 볼 수 있습니다."
,,,
#,Charts,차트,차트 화면은 시간의 흐름에 따른 경제 관련 여러 중요 지표를 보여줍니다. 세계 경제는 자국의 GDP에 영향을 미칠 것입니다. 부채 수준이 너무 높아지면 채권 시장의 불안을 높여 이자율이 오르며 부채의 소용돌이로 이어질 수 있으므로 부채 수준은 항상 염려해야 합니다.
,,,
#,Intel,정보,"여기는 정보 브리핑룸입니다. 우리는 여러 조직을 감시합니다. 이들 조직 일부는 비교적 무해하지만, 사람들을 더 극단적이고 위험한 그룹으로 향하게 하는 '관문' 역할을 할 수 있으므로 우리는 그 구성원들을 예의 주시해야 합니다. 정부에 대한 공격을 방지할 가능성은 당신이 운영하는 보안 정책에 따라 달라집니다."
,,,
#,Polling,여론조사,"이것은 여론조사 데이터입니다. 시간이 지남에 따라 정부에 관한 의견이 어떻게 변했는지를 나타내는 각 유권자 그룹에 대한 선들을 보여줍니다. 색상 버튼을 사용하여 각 선을 켜고 끌 수 있으며 이름을 클릭하여 각 유권자 그룹을 방문할 수 있지만, 이것은 나중에 다시 살펴보겠습니다..."
#,Polling2,여론조사,여기 온 김에 포커스 그룹을 살펴봅시다. 포커스 그룹 버튼을 누르십시오.
#,FocusGroup,포커스 그룹,개인(하단에 정렬됨)은 무작위 포커스 그룹의 구성원입니다. 하단에 있는 개별 유권자를 클릭하여 해당 유권자에 관한 정보를 보거나 원형 파란색 아이콘으로 새 포커스 그룹을 만들 수 있습니다.
#,FocusGroup2,포커스 그룹,"이 도표는 개인이 소속 유권자 그룹과 어느 정도로 교류하고 있는지, 소속 그룹에서 그들이 접하는 의견이 무엇인지, 이 모든 것이 어떻게 합쳐져서 정부에 관한 이들의 최종 의견을 이루는지를 보여줍니다."
#,FocusGroup3,포커스 그룹,이제 여론조사로 알아본 정책의 인기도를 살펴보겠습니다. 정책 버튼을 누르십시오.
,,,
,,,
#,Cabinet,내각,이것은 각 정부 부서에서 일하는 사람을 보여줍니다. 각 장관은 저마다 다른 수준의 경험과 충성도를 지닐 것이며 둘 다 시간이 지남에 따라 변할 수 있습니다. 경험 많은 장관들이 맡은 업무에서 더 효과적이며 정책을 더 빠르고 저렴하게 구현할 수 있습니다. 시간이 지남에 따라 장관의 충성도는 달라질 수 있음을 기억하십시오.
#,Cabinet2,내각,"불충한 장관은 정치 자본을 덜 제공하므로 결국 몇몇 장관을 해임하거나 내각을 완전히 개편해야 할 수도 있습니다. 또한, 각 장관은 저마다 다른 유권자 그룹에게 인기가 있으므로 내각에 등용하면 특정 유권자를 어느 정도 만족시킬 수 있습니다."
#,Cabinet3,내각,이제 각료들의 경력 전망을 결정하는 것은 당신에게 맡기겠습니다. 누군가를 해고하기 전에 항상 후임으로 임용할 인물이 누가 있는지를 살펴볼 수 있다는 것을 잊지 마십시오...
,,,
#,Polls,여론조사,이 차트는 지금 선거가 치러진다면 당신에게 투표할 것이라 말하는 유권자의 백분율 추정치를 보여줍니다. 투표율이 100%일 리가 없으므로 정확하지 않을 수 있습니다. 어느 쪽으로든 강한 견해가 없는 유권자는 선거를 의무화하지 않는 한 선거날 투표에 참여하지 않습니다.
,,,
,,,
#,Electioneering,선거 운동,이것은 '선거 운동' 화면의 여러 탭 중에서 선택하여 우리 당의 다양한 측면과 재선 찬스를 볼 수 있습니다! 연설이나 공약 같은 일부 옵션은 선거 직전까지 적용되지 않을 수 있으므로 그때까지는 국가 운영에 집중하시는 것이 가장 좋습니다.
#,Manifestos,공약,공약 선언은 선택 사항이지만 막바지에 선거 전 부스트가 필요한 경우 유권자에게 거창한 약속을 하는 것이 유리합니다. 재선에 성공하고 나서 이 약속을 어기면 유권자들에게 응징받을 수 있다는 점에 유의하십시오.
#,Speeches,연설,"연설은 선거에 앞서 턴을 돌아가며 할 수 있습니다. 이런 연설의 긍정적인 면으로는, 실제 제안이나 약속을 하지 않고도 유권자 그룹의 지지를 얻을 수 있다는 것입니다. 나쁜 면이 있다면 선택하는 각 슬로건이 일부 유권자를 화나게 하거나 일부 유권자를 기쁘게 할 수 있으므로 현명하게 선택해야 한다는 것입니다."
#,Speech Results,연설 결과,"이 화면은 당신의 연설 결과를 보여주며, 한 슬로건에서 다른 슬로건으로 넘어가면서 전체 유권자를 표본으로 한 광범위한 포커스 그룹에서 연설이 얼마나 인기가 있는지 보여줍니다. 값이 클수록 더 좋긴 하지만, 모든 사람을 기쁘게 하는 연설은 거의 없습니다."
#,Fundraising,모금 활동,"선거 운동을 위한 모금 활동은 부분적으로 활동가를 통해 이루어지며 부분적으로는 부유한 기부자를 통해 이루어집니다. 활동가들은 당신의 행동에 따라 시간이 지나면서 합류하거나 떠납니다. 거액 기부자들도 비슷하게 움직이지만, 여기에서 이들의 기분을 가늠할 수 있으므로 이들이 화내기 전에 알아채 기부금을 잃는 것을 미리 막을 수 있습니다."
#,Perceptions,인식,"후보자와 정당에 대한 유권자의 인식은 '미정' 유권자에게 중요한 영향을 미칠 수 있습니다. 여당이 3가지 주요 인식 측정에서 모두 높은 값을 얻는다면 가장 이상적이겠지만, 현실에서는 당신이 시행한 정책 탓에 그런 결과가 나오는 건 불가능합니다. 다만 언론 이벤트를 통해 대중의 인식을 보정할 수는 있습니다. 선거가 아직 먼 시점에 언론 이벤트를 낭비하지 마십시오. 시간이 지나면서 효과가 사라지기 때문입니다."
,,,
#,Happiness,행복,이 차트는 이 유권자 그룹의 모든 사람을 보여주며 이들이 행복(초록)에서 분노(빨강)까지의 스펙트럼에서 어디쯤 있는지 보여줍니다. 유권자는 다양한 그룹에 속해 있으므로 이 그룹만이 그들의 의견에 영향을 미치는 것은 아닙니다. 각 점을 클릭하면 포커스 그룹 화면 안에 이 유권자가 표시됩니다.